url,name,make,model,year,color,mileage,mileage_unit,price,price_currency,availability,engine_type,fuel_type,transmission,vehicle_configuration,highlight_items,feature_highlights,feature_options,trim,location,vehicle_age,stock_number,dealer_name,mileage_analysis,fuel_economy_city,fuel_economy_highway,fuel_economy_combined,fuel_cost_cents_per_litre,specs,description,price_analysis,price_analysis_market_price,price_analysis_evaluation
https://www.autotrader.ca/a/honda/cr-v/lower%20sackville/nova%20scotia/5_63521387_20240304155546088/,2020 Honda CR-V,Honda,CR-V,2020,Radiant Red Metallic,48614,KMT,31415,CAD,https://schema.org/InStock,1.5L 4cyl,Gas,CVT,EX-L,"['Intermittent Wipers', 'Heated Mirrors', 'Telescoping Steering', 'Excellent Condition']","{'showModule': True, 'showAllOptions': True, 'highlights': ['Intermittent Wipers', 'Heated Mirrors', 'Telescoping Steering', 'All Wheel Drive', 'Roll Bar', 'Heated Seats'], 'options': ['Air Conditioning', 'Power Steering', 'Traction Control', 'Dual Airbag', 'Dual Climate Controls', 'Fog Lights', 'Spoiler', 'Tachometer', 'Anti-Lock Brakes (ABS)', 'Leather Interior', 'Tilt Steering', 'Rear Defroster', 'Cruise Control', 'Panoramic Sunroof', 'Power Mirrors', 'Security System', 'Power Windows', 'Stability Control', 'Auto Dimming Mirrors'], 'extraOption': '1-touch down,1-touch up,Automatic temperature control,Brake assist,Delay-off headlights,Driver door bin,Driver vanity mirror,Four wheel independent suspension,Front anti-roll bar,Front beverage holders,Front centre armrest,Front reading lights,Ignition disable,Leather shift knob,Low tire pressure warning,Memory seat,Occupant sensing airbag,Outside temperature display,Overhead airbag,Passenger door bin,Perimeter/approach lights,Rear anti-roll bar,Rear beverage holders,Rear door bins,Rear seat centre armrest,Speed-sensing steering,Split folding rear seat,Steering wheel mounted audio controls,Turn signal indicator mirrors,Variably intermittent wipers,Trunk/hatch auto-latch,Auto high-beam headlights,Power 4-way driver lumbar support,Configurable,Exterior parking camera rear,Exterior parking camera right', 'dataLayerSectionName': 'features', 'order': 150, 'navigationAnchorName': 'vdp-options-widget', 'navigationTitle': 'Features &'}","{'showModule': True, 'showAllOptions': True, 'highlights': ['Intermittent Wipers', 'Heated Mirrors', 'Telescoping Steering', 'All Wheel Drive', 'Roll Bar', 'Heated Seats'], 'options': ['Air Conditioning', 'Power Steering', 'Traction Control', 'Dual Airbag', 'Dual Climate Controls', 'Fog Lights', 'Spoiler', 'Tachometer', 'Anti-Lock Brakes (ABS)', 'Leather Interior', 'Tilt Steering', 'Rear Defroster', 'Cruise Control', 'Panoramic Sunroof', 'Power Mirrors', 'Security System', 'Power Windows', 'Stability Control', 'Auto Dimming Mirrors'], 'extraOption': '1-touch down,1-touch up,Automatic temperature control,Brake assist,Delay-off headlights,Driver door bin,Driver vanity mirror,Four wheel independent suspension,Front anti-roll bar,Front beverage holders,Front centre armrest,Front reading lights,Ignition disable,Leather shift knob,Low tire pressure warning,Memory seat,Occupant sensing airbag,Outside temperature display,Overhead airbag,Passenger door bin,Perimeter/approach lights,Rear anti-roll bar,Rear beverage holders,Rear door bins,Rear seat centre armrest,Speed-sensing steering,Split folding rear seat,Steering wheel mounted audio controls,Turn signal indicator mirrors,Variably intermittent wipers,Trunk/hatch auto-latch,Auto high-beam headlights,Power 4-way driver lumbar support,Configurable,Exterior parking camera rear,Exterior parking camera right', 'dataLayerSectionName': 'features', 'order': 150, 'navigationAnchorName': 'vdp-options-widget', 'navigationTitle': 'Features &'}",EX-L,Lower Sackville,,243138B,Recar Halifax,Low,8.7,7.4,8.1,140.9,"{'specs': [{'key': 'Kilometres', 'value': '48,614 km'}, {'key': 'Status', 'value': 'Used'}, {'key': 'Trim', 'value': 'EX-L'}, {'key': 'Body Type', 'value': 'SUV'}, {'key': 'Engine', 'value': '1.5L 4cyl'}, {'key': 'Cylinder', 'value': '4'}, {'key': 'Transmission', 'value': 'CVT'}, {'key': 'Drivetrain', 'value': 'AWD'}, {'key': 'Stock Number', 'value': '243138B'}, {'key': 'Exterior Colour', 'value': 'Radiant Red Metallic'}, {'key': 'Doors', 'value': '2'}, {'key': 'Fuel Type', 'value': 'Gas'}, {'key': 'City Fuel Economy', 'value': '8.7L/100km'}, {'key': 'Hwy Fuel Economy', 'value': '7.4L/100km'}], 'showMadeIn': True, 'madeIn': 'canadaFlag', 'dataLayerSectionName': 'specs', 'order': 110, 'navigationAnchorName': 'vdp-specs-widget', 'navigationTitle': 'Specs'}","[{'description': ""\n \nReduced $1,500! EX-L AWD withApple CarPlay,Dual Zone Climate,Heated Seats and Wheel andRemote Start!\n \nDiscover the impressive performance of this 2020 Honda CR-V EX-L, featuring a 1.5L 4-cylinder engine and an automatic transmission. This CR-V delivers a blend of power and efficiency, providing a smooth and responsive driving experience. With its turbocharged engine, youll enjoy spirited acceleration and confident handling on both city streets and highway drives.\n \nInside, the CR-V EX-L offers a luxurious and spacious cabin designed for maximum comfort. High-quality materials and meticulous attention to detail create a refined atmosphere, while the roomy interior ensures ample legroom for passengers. The addition of premium features and a user-friendly infotainment system enhances your driving experience, making every journey enjoyable.\n \nThis 2020 Honda CR-V EX-L combines stylish design with exceptional comfort and performance. Its striking red exterior and low mileage highlight its excellent condition, offering a well-rounded SUV ready to meet your driving needs and elevate your daily commute.\n \nOnly $31,415 or $143/Wk Tax Inc $0 Down! Email ********** for more info!\n \nAll ReCar Certified Vehicles come with our 360 degree inspection which is a very meticulous and comprehensive 170 point mechanical and cosmetic inspection and is backed by our 12 month ReCar Certified Guarantee FREE of charge! For added convenience and peace of mind, we offer a 7 day test drive which means within the first 7 days of ownership, if you are unhappy with the vehicle or feel you made the wrong selection, you may bring it back to ReCar and exchange it for a different vehicle in stock. This Certified vehicle comes with a Brand new NB MVI sticker on it, fresh oil and filter change and complimentary CarFax vehicle history report. Our Certified vehicles also get the Guaranteed Best Interest rates and we offer Customer focused Fixed, No Pressure Pricing. Our Non Commissioned vehicle advisors also offer test drives to your door on our Certified vehicles!\n \nFast, Flexible Financing for Everyone  We work with over 16 lenders; not only to get you the best possible rates but to also provide you with the best possible terms, regardless of your credit situation. No Obligation Pre-Approvals within 2 hours from the Comfort of Your Home!! Apply Online @ **********\n \n\n \nIt is the purchaser's responsibility to personally verify the year, make, model, mileage, options and any remaining or extended warranty prior to purchasing this vehicle. Although many of our ReCar Certified vehicles have multiple sets of keys, a minimum of 1 key can be guaranteed with our ReCar Certified vehicles. ""}]","This vehicle is <b>$1,628 BELOW MARKET (4%)</b>. It is compared to similar vehicles in the <b>Lower Sackville</b> and adjacent area. It’s based on kilometres, year, make, model, trim, manufacturer certification, manufacturer packages, options, and much more.",,GreatPrice
https://www.autotrader.ca/a/honda/cr-v/halifax/nova%20scotia/5_63856578_20170918134535877/,2025 Honda CR-V,Honda,CR-V,2025,Crystal Black Pearl,,,44525,CAD,https://schema.org/InStock,Intercooled Turbo Regular Unleaded I-4 1.5 L/91,Gas,CVT,Sport,[],"{'showModule': False, 'showAllOptions': False, 'dataLayerSectionName': 'features', 'order': 70, 'navigationAnchorName': 'vdp-options-widget', 'navigationTitle': 'Features &'}","{'showModule': False, 'showAllOptions': False, 'dataLayerSectionName': 'features', 'order': 70, 'navigationAnchorName': 'vdp-options-widget', 'navigationTitle': 'Features &'}",Sport,Halifax,,NH109574,Colonial Honda,,,,,,"{'specs': [{'key': 'Kilometres', 'value': '5 km'}, {'key': 'Status', 'value': 'New'}, {'key': 'Trim', 'value': 'Sport'}, {'key': 'Body Type', 'value': 'SUV'}, {'key': 'Engine', 'value': 'Intercooled Turbo Regular Unleaded I-4 1.5 L/91'}, {'key': 'Cylinder', 'value': '4'}, {'key': 'Transmission', 'value': 'CVT'}, {'key': 'Drivetrain', 'value': 'AWD'}, {'key': 'Stock Number', 'value': 'NH109574'}, {'key': 'Exterior Colour', 'value': 'Crystal Black Pearl'}, {'key': 'Interior Colour', 'value': 'Black'}, {'key': 'Passengers', 'value': '5'}, {'key': 'Doors', 'value': '4'}, {'key': 'Fuel Type', 'value': 'Gas'}, {'key': 'City Fuel Economy', 'value': '9.1L/100km'}, {'key': 'Hwy Fuel Economy', 'value': '7.6L/100km'}], 'showMadeIn': True, 'madeIn': 'canadaFlag', 'dataLayerSectionName': 'specs', 'order': 110, 'navigationAnchorName': 'vdp-specs-widget', 'navigationTitle': 'Specs'}",[],,,
https://www.autotrader.ca/a/honda/cr-v/kentville/nova%20scotia/5_63828458_20160729153451854/,2021 Honda CR-V,Honda,CR-V,2021,Crystal Black Pearl,62093,KMT,32991,CAD,https://schema.org/InStock,LIGHT/MEDIUM DUTY,Gas,Automatic,"EX-L, sunroof, heated seats, handsfree reverse cam","['Intermittent Wipers', 'Heated Mirrors', 'Keyless Entry', 'Premium Audio']","{'showModule': True, 'showAllOptions': True, 'highlights': ['Intermittent Wipers', 'Heated Mirrors', 'Keyless Entry', 'Premium Audio', 'Power Locks', 'Power Steering'], 'options': ['Traction Control', 'Remote Trunk Release', 'AM/FM Stereo', 'Illuminated Visor Mirror', 'Fog Lights', 'Child-Safety Locks', 'Bluetooth', 'Remote Start', 'Memory Seats', 'Power Lift Gates', 'Power Seat', 'Daytime Running Lights', 'Anti-Lock Brakes (ABS)', 'Rear View Camera', 'Adaptive Cruise Control', 'Privacy Glass', 'Leather Wrap Wheel', 'Leather Interior', 'Tilt Steering', 'Rear Defroster', 'Cruise Control', 'Security System', 'Power Windows', 'Climate Control', 'Passenger Airbag', 'Stability Control', 'Wood Trim Interior', 'Trip Computer', 'Satellite Radio', 'Auto Dimming Mirrors', 'Auto On/Off Headlamps', 'Bucket Seats', 'Driver Side Airbag', 'Heated Steering Wheel', 'Lane Departure Warning', 'Steering Wheel Audio Controls'], 'extraOption': 'Front Side Air Bag,Front Head Air Bag,Rear Head Air Bag,Multi-Zone A/C,ABS,4-Wheel Disc Brakes,Floor Mats,Heated Mirrors,Power Mirror(s),Sun/Moonroof,Pass-Through Rear Seat,Temporary Spare Tire,Generic Sun/Moonroof,MP3 Capability,Heated Front Seat(s),Immobilizer,Integrated Turn Signal Mirrors,Driver Vanity Mirror,Passenger Vanity Mirror,Driver Adjustable Lumbar,Tire Pressure Monitor,Universal Garage Door Opener,Bluetooth Connection,Remote Engine Start,Back-Up Camera,Brake Assist,Keyless Start,Auxiliary Audio Input,Heated Rear Seat(s),Cargo Shade,Rear Bench Seat,Passenger Air Bag Sensor,Lane Keeping Assist,Smart Device Integration,Front Collision Mitigation,Automatic Highbeams,Requires Subscription,Driver Monitoring', 'dataLayerSectionName': 'features', 'order': 150, 'navigationAnchorName': 'vdp-options-widget', 'navigationTitle': 'Features &'}","{'showModule': True, 'showAllOptions': True, 'highlights': ['Intermittent Wipers', 'Heated Mirrors', 'Keyless Entry', 'Premium Audio', 'Power Locks', 'Power Steering'], 'options': ['Traction Control', 'Remote Trunk Release', 'AM/FM Stereo', 'Illuminated Visor Mirror', 'Fog Lights', 'Child-Safety Locks', 'Bluetooth', 'Remote Start', 'Memory Seats', 'Power Lift Gates', 'Power Seat', 'Daytime Running Lights', 'Anti-Lock Brakes (ABS)', 'Rear View Camera', 'Adaptive Cruise Control', 'Privacy Glass', 'Leather Wrap Wheel', 'Leather Interior', 'Tilt Steering', 'Rear Defroster', 'Cruise Control', 'Security System', 'Power Windows', 'Climate Control', 'Passenger Airbag', 'Stability Control', 'Wood Trim Interior', 'Trip Computer', 'Satellite Radio', 'Auto Dimming Mirrors', 'Auto On/Off Headlamps', 'Bucket Seats', 'Driver Side Airbag', 'Heated Steering Wheel', 'Lane Departure Warning', 'Steering Wheel Audio Controls'], 'extraOption': 'Front Side Air Bag,Front Head Air Bag,Rear Head Air Bag,Multi-Zone A/C,ABS,4-Wheel Disc Brakes,Floor Mats,Heated Mirrors,Power Mirror(s),Sun/Moonroof,Pass-Through Rear Seat,Temporary Spare Tire,Generic Sun/Moonroof,MP3 Capability,Heated Front Seat(s),Immobilizer,Integrated Turn Signal Mirrors,Driver Vanity Mirror,Passenger Vanity Mirror,Driver Adjustable Lumbar,Tire Pressure Monitor,Universal Garage Door Opener,Bluetooth Connection,Remote Engine Start,Back-Up Camera,Brake Assist,Keyless Start,Auxiliary Audio Input,Heated Rear Seat(s),Cargo Shade,Rear Bench Seat,Passenger Air Bag Sensor,Lane Keeping Assist,Smart Device Integration,Front Collision Mitigation,Automatic Highbeams,Requires Subscription,Driver Monitoring', 'dataLayerSectionName': 'features', 'order': 150, 'navigationAnchorName': 'vdp-options-widget', 'navigationTitle': 'Features &'}","EX-L, sunroof, heated seats, handsfree reverse cam",Kentville,,P4004,Kings County Honda,Average,8.7,7.4,8.1,140.9,"{'specs': [{'key': 'Kilometres', 'value': '62,093 km'}, {'key': 'Status', 'value': 'Used'}, {'key': 'Trim', 'value': 'EX-L, sunroof, heated seats, handsfree reverse cam'}, {'key': 'Body Type', 'value': 'SUV'}, {'key': 'Engine', 'value': 'LIGHT/MEDIUM DUTY'}, {'key': 'Cylinder', 'value': '4'}, {'key': 'Transmission', 'value': 'Automatic'}, {'key': 'Drivetrain', 'value': 'AWD'}, {'key': 'Stock Number', 'value': 'P4004'}, {'key': 'Exterior Colour', 'value': 'Crystal Black Pearl'}, {'key': 'Interior Colour', 'value': 'Black'}, {'key': 'Passengers', 'value': '5'}, {'key': 'Doors', 'value': '4'}, {'key': 'Fuel Type', 'value': 'Gas'}, {'key': 'City Fuel Economy', 'value': '8.7L/100km'}, {'key': 'Hwy Fuel Economy', 'value': '7.4L/100km'}], 'showMadeIn': True, 'madeIn': 'canadaFlag', 'dataLayerSectionName': 'specs', 'order': 110, 'navigationAnchorName': 'vdp-specs-widget', 'navigationTitle': 'Specs'}","[{'description': ""          At Kings Honda you will experience an outstanding car buying experience. We make every effort to exceed your expectations. TheKings Hondateam listens to you to offer a personalized and unique customer service. All our vehicles are in excellent mechanical and aesthetic condition and offer attractive warranties.Kings Hondaoffers the complete collection of new Honda vehicles and a wide selection of used vehicles at the best prices. Whatever your budget,Kings Hondawill help you find a vehicle that suits you. A long-standing member of the community we serve, and a business firmly committed to providing, friendly, relaxed, down-home service to our valued clientele, Kings Honda is happy to hear from you with any questions or comments you may have about our Honda products and services. \r\n\r\nWarranty:\r\n Honda Certified Used Vehicles are highly sought after thanks to Honda's legendary reputation for durability, quality, and reliability. In order to earn the distinction of Honda Certified, each used Honda vehicle must pass a series of strict Honda Canada ""}]","This vehicle is <b>$916 BELOW MARKET (2%)</b>. It is compared to similar vehicles in the <b>Kentville</b> and adjacent area. It’s based on kilometres, year, make, model, trim, manufacturer certification, manufacturer packages, options, and much more.",,GoodPrice
https://www.autotrader.ca/a/honda/cr-v/kentville/nova%20scotia/5_63180235_20160729153451854/,2021 Honda CR-V,Honda,CR-V,2021,Modern Steel Metallic,36614,KMT,30991,CAD,https://schema.org/InStock,4 Cylinder Engine 1.5L,Gas,Automatic,"LX - AWD, Heated seats, ACC, Alloy rims, A.C","['Intermittent Wipers', 'Heated Mirrors', 'Keyless Entry', 'Air Conditioning']","{'showModule': True, 'showAllOptions': True, 'highlights': ['Intermittent Wipers', 'Heated Mirrors', 'Keyless Entry', 'Air Conditioning', 'Power Locks', 'Power Steering'], 'options': ['Traction Control', 'AM/FM Stereo', 'Child-Safety Locks', 'Bluetooth', 'Remote Start', 'Daytime Running Lights', 'Anti-Lock Brakes (ABS)', 'Rear View Camera', 'Adaptive Cruise Control', 'Privacy Glass', 'Tilt Steering', 'Rear Defroster', 'Cruise Control', 'Security System', 'Power Windows', 'Climate Control', 'Cloth Interior', 'Passenger Airbag', 'Stability Control', 'Trip Computer', 'Auto On/Off Headlamps', 'Bucket Seats', 'Driver Side Airbag', 'Lane Departure Warning', 'MP3 CD Player', 'Steering Wheel Audio Controls'], 'extraOption': 'Front Side Air Bag,Front Head Air Bag,Rear Head Air Bag,Multi-Zone A/C,ABS,4-Wheel Disc Brakes,Floor Mats,Heated Mirrors,Power Mirror(s),Pass-Through Rear Seat,Temporary Spare Tire,Heated Front Seat(s),Immobilizer,Driver Vanity Mirror,Passenger Vanity Mirror,Tire Pressure Monitor,Bluetooth Connection,Remote Engine Start,Back-Up Camera,Brake Assist,Keyless Start,Auxiliary Audio Input,Rear Bench Seat,Passenger Air Bag Sensor,Lane Keeping Assist,Smart Device Integration,Front Collision Mitigation,Automatic Highbeams,Driver Monitoring', 'dataLayerSectionName': 'features', 'order': 150, 'navigationAnchorName': 'vdp-options-widget', 'navigationTitle': 'Features &'}","{'showModule': True, 'showAllOptions': True, 'highlights': ['Intermittent Wipers', 'Heated Mirrors', 'Keyless Entry', 'Air Conditioning', 'Power Locks', 'Power Steering'], 'options': ['Traction Control', 'AM/FM Stereo', 'Child-Safety Locks', 'Bluetooth', 'Remote Start', 'Daytime Running Lights', 'Anti-Lock Brakes (ABS)', 'Rear View Camera', 'Adaptive Cruise Control', 'Privacy Glass', 'Tilt Steering', 'Rear Defroster', 'Cruise Control', 'Security System', 'Power Windows', 'Climate Control', 'Cloth Interior', 'Passenger Airbag', 'Stability Control', 'Trip Computer', 'Auto On/Off Headlamps', 'Bucket Seats', 'Driver Side Airbag', 'Lane Departure Warning', 'MP3 CD Player', 'Steering Wheel Audio Controls'], 'extraOption': 'Front Side Air Bag,Front Head Air Bag,Rear Head Air Bag,Multi-Zone A/C,ABS,4-Wheel Disc Brakes,Floor Mats,Heated Mirrors,Power Mirror(s),Pass-Through Rear Seat,Temporary Spare Tire,Heated Front Seat(s),Immobilizer,Driver Vanity Mirror,Passenger Vanity Mirror,Tire Pressure Monitor,Bluetooth Connection,Remote Engine Start,Back-Up Camera,Brake Assist,Keyless Start,Auxiliary Audio Input,Rear Bench Seat,Passenger Air Bag Sensor,Lane Keeping Assist,Smart Device Integration,Front Collision Mitigation,Automatic Highbeams,Driver Monitoring', 'dataLayerSectionName': 'features', 'order': 150, 'navigationAnchorName': 'vdp-options-widget', 'navigationTitle': 'Features &'}","LX - AWD, Heated seats, ACC, Alloy rims, A.C",Kentville,,25038A,Kings County Honda,Low,8.7,7.4,8.1,140.9,"{'specs': [{'key': 'Kilometres', 'value': '36,614 km'}, {'key': 'Status', 'value': 'Used'}, {'key': 'Trim', 'value': 'LX - AWD, Heated seats, ACC, Alloy rims, A.C'}, {'key': 'Body Type', 'value': 'SUV'}, {'key': 'Engine', 'value': '4 Cylinder Engine 1.5L'}, {'key': 'Cylinder', 'value': '4'}, {'key': 'Transmission', 'value': 'Automatic'}, {'key': 'Drivetrain', 'value': 'AWD'}, {'key': 'Stock Number', 'value': '25038A'}, {'key': 'Exterior Colour', 'value': 'Modern Steel Metallic'}, {'key': 'Interior Colour', 'value': 'Black'}, {'key': 'Passengers', 'value': '5'}, {'key': 'Doors', 'value': '4'}, {'key': 'Fuel Type', 'value': 'Gas'}, {'key': 'City Fuel Economy', 'value': '8.7L/100km'}, {'key': 'Hwy Fuel Economy', 'value': '7.4L/100km'}], 'showMadeIn': True, 'madeIn': 'canadaFlag', 'dataLayerSectionName': 'specs', 'order': 110, 'navigationAnchorName': 'vdp-specs-widget', 'navigationTitle': 'Specs'}","[{'description': '          At Kings Honda you will experience an outstanding car buying experience. We make every effort to exceed your expectations. TheKings Hondateam listens to you to offer a personalized and unique customer service. All our vehicles are in excellent mechanical and aesthetic condition and offer attractive warranties.Kings Hondaoffers the complete collection of new Honda vehicles and a wide selection of used vehicles at the best prices. Whatever your budget,Kings Hondawill help you find a vehicle that suits you. A long-standing member of the community we serve, and a business firmly committed to providing, friendly, relaxed, down-home service to our valued clientele, Kings Honda is happy to hear from you with any questions or comments you may have about our Honda products and services. \r\n\r\nWarranty:\r\n 3 Month/ 5,000KM complimentary powertrain warranty!'}]","This vehicle is <b>$576 BELOW MARKET (1%)</b>. It is compared to similar vehicles in the <b>Kentville</b> and adjacent area. It’s based on kilometres, year, make, model, trim, manufacturer certification, manufacturer packages, options, and much more.",,GoodPrice
https://www.autotrader.ca/a/honda/cr-v/dartmouth/nova%20scotia/5_63862857_20150813141013738/,2018 Honda CR-V,Honda,CR-V,2018,,168002,KMT,18999,CAD,https://schema.org/InStock,Intercooled Turbo Regular Unleaded I-4 1.5 L/91,Gas,CVT,EX,[],"{'showModule': False, 'showAllOptions': False, 'dataLayerSectionName': 'features', 'order': 150, 'navigationAnchorName': 'vdp-options-widget', 'navigationTitle': 'Features &'}","{'showModule': False, 'showAllOptions': False, 'dataLayerSectionName': 'features', 'order': 150, 'navigationAnchorName': 'vdp-options-widget', 'navigationTitle': 'Features &'}",EX,Dartmouth,,T259937AAA,Steele Chevrolet Buick GMC Cadillac,Average,8.7,7.2,8.0,140.9,"{'specs': [{'key': 'Kilometres', 'value': '168,002 km'}, {'key': 'Status', 'value': 'Used'}, {'key': 'Trim', 'value': 'EX'}, {'key': 'Body Type', 'value': 'SUV'}, {'key': 'Engine', 'value': 'Intercooled Turbo Regular Unleaded I-4 1.5 L/91'}, {'key': 'Cylinder', 'value': '4'}, {'key': 'Transmission', 'value': 'CVT'}, {'key': 'Drivetrain', 'value': 'AWD'}, {'key': 'Stock Number', 'value': 'T259937AAA'}, {'key': 'Passengers', 'value': '5'}, {'key': 'Doors', 'value': '4'}, {'key': 'Fuel Type', 'value': 'Gas'}, {'key': 'City Fuel Economy', 'value': '8.7L/100km'}, {'key': 'Hwy Fuel Economy', 'value': '7.2L/100km'}], 'showMadeIn': True, 'madeIn': 'canadaFlag', 'dataLayerSectionName': 'specs', 'order': 110, 'navigationAnchorName': 'vdp-specs-widget', 'navigationTitle': 'Specs'}",[],"This vehicle is <b>$1,751 BELOW MARKET (8%)</b>. It is compared to similar vehicles in the <b>Dartmouth</b> and adjacent area. It’s based on kilometres, year, make, model, trim, manufacturer certification, manufacturer packages, options, and much more.",,GreatPrice
