url,name,make,model,year,color,mileage,mileage_unit,price,price_currency,availability,engine_type,fuel_type,transmission,vehicle_configuration,highlight_items,feature_highlights,feature_options,trim,location,vehicle_age,stock_number,dealer_name,mileage_analysis,fuel_economy_city,fuel_economy_highway,fuel_economy_combined,fuel_cost_cents_per_litre,specs,description,price_analysis,price_analysis_market_price,price_analysis_evaluation
https://www.autotrader.ca/a/honda/cr-v/kentville/nova%20scotia/5_63828454_20160729153451854/,2019 Honda CR-V,Honda,CR-V,2019,Modern Steel Metallic,70393,KMT,23979,CAD,https://schema.org/InStock,LIGHT/MEDIUM DUTY,Gas,Automatic,LX,"['Intermittent Wipers', 'Heated Mirrors', 'Keyless Entry', 'All Wheel Drive']","{'showModule': True, 'showAllOptions': True, 'highlights': ['Intermittent Wipers', 'Heated Mirrors', 'Keyless Entry', 'All Wheel Drive', 'Power Locks', 'Air Conditioning'], 'options': ['Power Steering', 'Traction Control', 'AM/FM Stereo', 'Child-Safety Locks', 'Bluetooth', 'Remote Start', 'Daytime Running Lights', 'Anti-Lock Brakes (ABS)', 'Rear View Camera', 'Adaptive Cruise Control', 'Privacy Glass', 'Tilt Steering', 'Rear Defroster', 'Cruise Control', 'Security System', 'Power Windows', 'Climate Control', 'Cloth Interior', 'Passenger Airbag', 'Stability Control', 'Trip Computer', 'Auto On/Off Headlamps', 'Bucket Seats', 'Driver Side Airbag', 'Lane Departure Warning', 'Steering Wheel Audio Controls'], 'extraOption': 'Front Side Air Bag,Front Head Air Bag,Rear Head Air Bag,Multi-Zone A/C,ABS,4-Wheel Disc Brakes,Floor Mats,Heated Mirrors,Power Mirror(s),Pass-Through Rear Seat,Temporary Spare Tire,Aluminum Wheels,MP3 Capability,Heated Front Seat(s),Immobilizer,Driver Vanity Mirror,Passenger Vanity Mirror,Tire Pressure Monitor,Bluetooth Connection,Remote Engine Start,Back-Up Camera,Brake Assist,Keyless Start,Auxiliary Audio Input,Rear Bench Seat,Passenger Air Bag Sensor,Lane Keeping Assist,Smart Device Integration,Front Collision Mitigation,Automatic Highbeams,Driver Monitoring', 'dataLayerSectionName': 'features', 'order': 150, 'navigationAnchorName': 'vdp-options-widget', 'navigationTitle': 'Features &'}","{'showModule': True, 'showAllOptions': True, 'highlights': ['Intermittent Wipers', 'Heated Mirrors', 'Keyless Entry', 'All Wheel Drive', 'Power Locks', 'Air Conditioning'], 'options': ['Power Steering', 'Traction Control', 'AM/FM Stereo', 'Child-Safety Locks', 'Bluetooth', 'Remote Start', 'Daytime Running Lights', 'Anti-Lock Brakes (ABS)', 'Rear View Camera', 'Adaptive Cruise Control', 'Privacy Glass', 'Tilt Steering', 'Rear Defroster', 'Cruise Control', 'Security System', 'Power Windows', 'Climate Control', 'Cloth Interior', 'Passenger Airbag', 'Stability Control', 'Trip Computer', 'Auto On/Off Headlamps', 'Bucket Seats', 'Driver Side Airbag', 'Lane Departure Warning', 'Steering Wheel Audio Controls'], 'extraOption': 'Front Side Air Bag,Front Head Air Bag,Rear Head Air Bag,Multi-Zone A/C,ABS,4-Wheel Disc Brakes,Floor Mats,Heated Mirrors,Power Mirror(s),Pass-Through Rear Seat,Temporary Spare Tire,Aluminum Wheels,MP3 Capability,Heated Front Seat(s),Immobilizer,Driver Vanity Mirror,Passenger Vanity Mirror,Tire Pressure Monitor,Bluetooth Connection,Remote Engine Start,Back-Up Camera,Brake Assist,Keyless Start,Auxiliary Audio Input,Rear Bench Seat,Passenger Air Bag Sensor,Lane Keeping Assist,Smart Device Integration,Front Collision Mitigation,Automatic Highbeams,Driver Monitoring', 'dataLayerSectionName': 'features', 'order': 150, 'navigationAnchorName': 'vdp-options-widget', 'navigationTitle': 'Features &'}",LX,Kentville,,P4050,Kings County Honda,Low,8.7,7.2,8.0,140.9,"{'specs': [{'key': 'Kilometres', 'value': '70,393 km'}, {'key': 'Status', 'value': 'Used'}, {'key': 'Trim', 'value': 'LX'}, {'key': 'Body Type', 'value': 'SUV'}, {'key': 'Engine', 'value': 'LIGHT/MEDIUM DUTY'}, {'key': 'Cylinder', 'value': '4'}, {'key': 'Transmission', 'value': 'Automatic'}, {'key': 'Drivetrain', 'value': 'AWD'}, {'key': 'Stock Number', 'value': 'P4050'}, {'key': 'Exterior Colour', 'value': 'Modern Steel Metallic'}, {'key': 'Interior Colour', 'value': 'Black'}, {'key': 'Passengers', 'value': '5'}, {'key': 'Doors', 'value': '4'}, {'key': 'Fuel Type', 'value': 'Gas'}, {'key': 'City Fuel Economy', 'value': '8.7L/100km'}, {'key': 'Hwy Fuel Economy', 'value': '7.2L/100km'}], 'showMadeIn': True, 'madeIn': 'canadaFlag', 'dataLayerSectionName': 'specs', 'order': 110, 'navigationAnchorName': 'vdp-specs-widget', 'navigationTitle': 'Specs'}","[{'description': ""5DR, AUTO, AWD ---- 5DR, AUTO, AWD \r\n\r\nWarranty:\r\n Honda Certified Used Vehicles are highly sought after thanks to Honda's legendary reputation for durability, quality, and reliability. In order to earn the distinction of Honda Certified, each used Honda vehicle must pass a series of strict Honda Canada ""}]","This vehicle is <b>$2,984 BELOW MARKET (11%)</b>. It is compared to similar vehicles in the <b>Kentville</b> and adjacent area. It’s based on kilometres, year, make, model, trim, manufacturer certification, manufacturer packages, options, and much more.",,GreatPrice
https://www.autotrader.ca/a/honda/cr-v/dartmouth/nova%20scotia/5_63875424_20150813141013738/,2019 Honda CR-V,Honda,CR-V,2019,,37102,KMT,29977,CAD,https://schema.org/InStock,Intercooled Turbo Regular Unleaded I-4 1.5 L/91,Gas,CVT,EX-L,[],"{'showModule': False, 'showAllOptions': False, 'dataLayerSectionName': 'features', 'order': 150, 'navigationAnchorName': 'vdp-options-widget', 'navigationTitle': 'Features &'}","{'showModule': False, 'showAllOptions': False, 'dataLayerSectionName': 'features', 'order': 150, 'navigationAnchorName': 'vdp-options-widget', 'navigationTitle': 'Features &'}",EX-L,Dartmouth,,N437789B,Steele Chevrolet Buick GMC Cadillac,Low,8.7,7.2,8.0,140.9,"{'specs': [{'key': 'Kilometres', 'value': '37,102 km'}, {'key': 'Status', 'value': 'Used'}, {'key': 'Trim', 'value': 'EX-L'}, {'key': 'Body Type', 'value': 'SUV'}, {'key': 'Engine', 'value': 'Intercooled Turbo Regular Unleaded I-4 1.5 L/91'}, {'key': 'Cylinder', 'value': '4'}, {'key': 'Transmission', 'value': 'CVT'}, {'key': 'Drivetrain', 'value': 'AWD'}, {'key': 'Stock Number', 'value': 'N437789B'}, {'key': 'Passengers', 'value': '5'}, {'key': 'Doors', 'value': '4'}, {'key': 'Fuel Type', 'value': 'Gas'}, {'key': 'City Fuel Economy', 'value': '8.7L/100km'}, {'key': 'Hwy Fuel Economy', 'value': '7.2L/100km'}], 'showMadeIn': True, 'madeIn': 'canadaFlag', 'dataLayerSectionName': 'specs', 'order': 110, 'navigationAnchorName': 'vdp-specs-widget', 'navigationTitle': 'Specs'}",[],"This vehicle is <b>$1,451 BELOW MARKET (4%)</b>. It is compared to similar vehicles in the <b>Dartmouth</b> and adjacent area. It’s based on kilometres, year, make, model, trim, manufacturer certification, manufacturer packages, options, and much more.",,GreatPrice
https://www.autotrader.ca/a/honda/cr-v/halifax/nova%20scotia/5_63449449_20170918134535877/,2022 Honda CR-V,Honda,CR-V,2022,Platinum White Pearl,57394,KMT,34294,CAD,https://schema.org/InStock,Intercooled Turbo Regular Unleaded I-4 1.5 L/91,Gas,CVT,,['Certified Pre-Owned'],"{'showModule': False, 'showAllOptions': False, 'dataLayerSectionName': 'features', 'order': 150, 'navigationAnchorName': 'vdp-options-widget', 'navigationTitle': 'Features &'}","{'showModule': False, 'showAllOptions': False, 'dataLayerSectionName': 'features', 'order': 150, 'navigationAnchorName': 'vdp-options-widget', 'navigationTitle': 'Features &'}",,Halifax,,TL8535,Colonial Honda,Average,8.7,7.4,8.1,140.9,"{'specs': [{'key': 'Kilometres', 'value': '57,394 km'}, {'key': 'Status', 'value': 'Used'}, {'key': 'Body Type', 'value': 'SUV'}, {'key': 'Engine', 'value': 'Intercooled Turbo Regular Unleaded I-4 1.5 L/91'}, {'key': 'Cylinder', 'value': '4'}, {'key': 'Transmission', 'value': 'CVT'}, {'key': 'Drivetrain', 'value': 'AWD'}, {'key': 'Stock Number', 'value': 'TL8535'}, {'key': 'Exterior Colour', 'value': 'Platinum White Pearl'}, {'key': 'Interior Colour', 'value': 'Black'}, {'key': 'Passengers', 'value': '5'}, {'key': 'Doors', 'value': '4'}, {'key': 'Fuel Type', 'value': 'Gas'}, {'key': 'City Fuel Economy', 'value': '8.7L/100km'}, {'key': 'Hwy Fuel Economy', 'value': '7.4L/100km'}], 'showMadeIn': True, 'madeIn': 'canadaFlag', 'dataLayerSectionName': 'specs', 'order': 110, 'navigationAnchorName': 'vdp-specs-widget', 'navigationTitle': 'Specs'}","[{'description': ""Visit Colonial Honda today at 2657 Robie St. in north end Halifax to take a closer look at one of Metro's most dynamic used vehicle inventories!   Our ultra-fast-paced dealership generates an exciting and diverse selection of used vehicles with fresh inventory arriving daily! One of the premier destinations in Halifax to shop used, we offer something for everyone - from Certified Pre-Owned Honda models, to 87-point inspected Steele certified off-make vehicles, to MVI-Only vehicles, or 'as is/where is/mvi-removed' vehicles for the do-it-yourself bargain hunters! \nIf you're looking for a used vehicle, your search won't be complete until you see our large selection. Need to start the process remotely? One of our team members will send you details or even better a walk around video of your vehicle of interest.  Contact Colonial Honda today...!\n ""}]","This vehicle is <b>$1,366 BELOW MARKET (3%)</b>. It is compared to similar vehicles in the <b>Halifax</b> and adjacent area. It’s based on kilometres, year, make, model, trim, manufacturer certification, manufacturer packages, options, and much more.",,GoodPrice
https://www.autotrader.ca/a/honda/cr-v/coldbrook/nova%20scotia/5_63092129_20160729155632808/,2016 Honda CR-V,Honda,CR-V,2016,Modern Steel Metallic,182201,KMT,11996,CAD,https://schema.org/InStock,LIGHT/MEDIUM DUTY,Gas,Automatic,"EX-L - AWD, Leather, Sunroof, Tow PKG, Cruise","['Intermittent Wipers', 'Heated Mirrors', 'Keyless Entry', 'Sold As-Is']","{'showModule': True, 'showAllOptions': True, 'highlights': ['Intermittent Wipers', 'Heated Mirrors', 'Keyless Entry', 'CD Player', 'Air Conditioning', 'Power Locks'], 'options': ['Power Steering', 'Traction Control', 'AM/FM Stereo', 'Illuminated Visor Mirror', 'Fog Lights', 'Child-Safety Locks', 'Bluetooth', 'Power Seat', 'Daytime Running Lights', 'Anti-Lock Brakes (ABS)', 'Rear View Camera', 'Privacy Glass', 'Leather Wrap Wheel', 'Leather Interior', 'Tilt Steering', 'Rear Defroster', 'Cruise Control', 'Security System', 'Power Windows', 'Climate Control', 'Passenger Airbag', 'Stability Control', 'Wood Trim Interior', 'Trip Computer', 'Satellite Radio', 'Auto On/Off Headlamps', 'Bucket Seats', 'Driver Side Airbag', 'MP3 CD Player', 'Steering Wheel Audio Controls'], 'extraOption': 'Front Side Air Bag,Front Head Air Bag,Rear Head Air Bag,Multi-Zone A/C,ABS,4-Wheel Disc Brakes,Floor Mats,Heated Mirrors,Power Mirror(s),Sun/Moonroof,Pass-Through Rear Seat,Temporary Spare Tire,Aluminum Wheels,Generic Sun/Moonroof,Heated Front Seat(s),Immobilizer,Driver Vanity Mirror,Passenger Vanity Mirror,Driver Adjustable Lumbar,Tire Pressure Monitor,Bluetooth Connection,Back-Up Camera,Brake Assist,Keyless Start,Auxiliary Audio Input,Cargo Shade,Rear Bench Seat,Passenger Air Bag Sensor,Smart Device Integration,Requires Subscription', 'dataLayerSectionName': 'features', 'order': 150, 'navigationAnchorName': 'vdp-options-widget', 'navigationTitle': 'Features &'}","{'showModule': True, 'showAllOptions': True, 'highlights': ['Intermittent Wipers', 'Heated Mirrors', 'Keyless Entry', 'CD Player', 'Air Conditioning', 'Power Locks'], 'options': ['Power Steering', 'Traction Control', 'AM/FM Stereo', 'Illuminated Visor Mirror', 'Fog Lights', 'Child-Safety Locks', 'Bluetooth', 'Power Seat', 'Daytime Running Lights', 'Anti-Lock Brakes (ABS)', 'Rear View Camera', 'Privacy Glass', 'Leather Wrap Wheel', 'Leather Interior', 'Tilt Steering', 'Rear Defroster', 'Cruise Control', 'Security System', 'Power Windows', 'Climate Control', 'Passenger Airbag', 'Stability Control', 'Wood Trim Interior', 'Trip Computer', 'Satellite Radio', 'Auto On/Off Headlamps', 'Bucket Seats', 'Driver Side Airbag', 'MP3 CD Player', 'Steering Wheel Audio Controls'], 'extraOption': 'Front Side Air Bag,Front Head Air Bag,Rear Head Air Bag,Multi-Zone A/C,ABS,4-Wheel Disc Brakes,Floor Mats,Heated Mirrors,Power Mirror(s),Sun/Moonroof,Pass-Through Rear Seat,Temporary Spare Tire,Aluminum Wheels,Generic Sun/Moonroof,Heated Front Seat(s),Immobilizer,Driver Vanity Mirror,Passenger Vanity Mirror,Driver Adjustable Lumbar,Tire Pressure Monitor,Bluetooth Connection,Back-Up Camera,Brake Assist,Keyless Start,Auxiliary Audio Input,Cargo Shade,Rear Bench Seat,Passenger Air Bag Sensor,Smart Device Integration,Requires Subscription', 'dataLayerSectionName': 'features', 'order': 150, 'navigationAnchorName': 'vdp-options-widget', 'navigationTitle': 'Features &'}","EX-L - AWD, Leather, Sunroof, Tow PKG, Cruise",Coldbrook,,P3906,Top Notch Auto Sales II,Average,9.5,7.5,8.6,140.9,"{'specs': [{'key': 'Kilometres', 'value': '182,201 km'}, {'key': 'Status', 'value': 'Used'}, {'key': 'Trim', 'value': 'EX-L - AWD, Leather, Sunroof, Tow PKG, Cruise'}, {'key': 'Body Type', 'value': 'SUV'}, {'key': 'Engine', 'value': 'LIGHT/MEDIUM DUTY'}, {'key': 'Cylinder', 'value': '4'}, {'key': 'Transmission', 'value': 'Automatic'}, {'key': 'Drivetrain', 'value': 'AWD'}, {'key': 'Stock Number', 'value': 'P3906'}, {'key': 'Exterior Colour', 'value': 'Modern Steel Metallic'}, {'key': 'Interior Colour', 'value': 'Black'}, {'key': 'Passengers', 'value': '5'}, {'key': 'Doors', 'value': '4'}, {'key': 'Fuel Type', 'value': 'Gas'}, {'key': 'City Fuel Economy', 'value': '9.5L/100km'}, {'key': 'Hwy Fuel Economy', 'value': '7.5L/100km'}], 'showMadeIn': True, 'madeIn': 'canadaFlag', 'dataLayerSectionName': 'specs', 'order': 110, 'navigationAnchorName': 'vdp-specs-widget', 'navigationTitle': 'Specs'}","[{'description': 'AS TRADED USED CAR POLICY: All vehicles sold As-is Wher-is are sold with no warranty implied or expressed. As-Is vehicles do not come with MVI Inspection. MVI sticker is removed at the time of sale or delivery. We encurage all customers to take any vehicle for inspection to a certified inspection station prior to purchase, at their convenience. All pricing is at or below wholesale. No inspection. No warranty or Exchange. all sales final/no refunds. '}]",,,
https://www.autotrader.ca/a/honda/cr-v/coldbrook/nova%20scotia/5_62643280_20160729155632808/,2017 Honda CR-V,Honda,CR-V,2017,Dark Olive Metallic,203586,KMT,17997,CAD,https://schema.org/InStock,4 Cylinder Engine 1.5L,Gas,Automatic,"Touring - AWD, Leather, Sunroof, Tow PKG, Alloys","['Intermittent Wipers', 'Heated Mirrors', 'Keyless Entry', 'Premium Audio']","{'showModule': True, 'showAllOptions': True, 'highlights': ['Intermittent Wipers', 'Heated Mirrors', 'Keyless Entry', 'Premium Audio', 'Air Conditioning', 'Power Locks'], 'options': ['Power Steering', 'Traction Control', 'Remote Trunk Release', 'Rain Sensor Wipers', 'AM/FM Stereo', 'Illuminated Visor Mirror', 'Fog Lights', 'Child-Safety Locks', 'Bluetooth', 'Remote Start', 'Memory Seats', 'Power Lift Gates', 'Power Seat', 'Daytime Running Lights', 'Anti-Lock Brakes (ABS)', 'Rear View Camera', 'Adaptive Cruise Control', 'Privacy Glass', 'Leather Wrap Wheel', 'Leather Interior', 'Tilt Steering', 'Rear Defroster', 'Navigation System', 'Cruise Control', 'Panoramic Sunroof', 'Security System', 'Power Windows', 'Climate Control', 'Passenger Airbag', 'Stability Control', 'Wood Trim Interior', 'Trip Computer', 'Satellite Radio', 'Auto Dimming Mirrors', 'Auto On/Off Headlamps', 'Bucket Seats', 'Driver Side Airbag', 'Heated Steering Wheel', 'Lane Departure Warning', 'MP3 CD Player', 'Steering Wheel Audio Controls'], 'extraOption': 'Front Side Air Bag,Front Head Air Bag,Rear Head Air Bag,Multi-Zone A/C,ABS,4-Wheel Disc Brakes,Floor Mats,Heated Mirrors,Power Mirror(s),Pass-Through Rear Seat,Temporary Spare Tire,Aluminum Wheels,Generic Sun/Moonroof,Heated Front Seat(s),Immobilizer,Integrated Turn Signal Mirrors,Driver Vanity Mirror,Passenger Vanity Mirror,Mirror Memory,Driver Adjustable Lumbar,Tire Pressure Monitor,Universal Garage Door Opener,Bluetooth Connection,Telematics,Remote Engine Start,Back-Up Camera,Brake Assist,Keyless Start,Auxiliary Audio Input,Heated Rear Seat(s),Cargo Shade,Rear Bench Seat,Passenger Air Bag Sensor,Blind Spot Monitor,Hands-Free Liftgate,Cross-Traffic Alert,Lane Keeping Assist,Smart Device Integration,Front Collision Mitigation,Automatic Highbeams,LED Headlights,Requires Subscription,Driver Monitoring', 'dataLayerSectionName': 'features', 'order': 150, 'navigationAnchorName': 'vdp-options-widget', 'navigationTitle': 'Features &'}","{'showModule': True, 'showAllOptions': True, 'highlights': ['Intermittent Wipers', 'Heated Mirrors', 'Keyless Entry', 'Premium Audio', 'Air Conditioning', 'Power Locks'], 'options': ['Power Steering', 'Traction Control', 'Remote Trunk Release', 'Rain Sensor Wipers', 'AM/FM Stereo', 'Illuminated Visor Mirror', 'Fog Lights', 'Child-Safety Locks', 'Bluetooth', 'Remote Start', 'Memory Seats', 'Power Lift Gates', 'Power Seat', 'Daytime Running Lights', 'Anti-Lock Brakes (ABS)', 'Rear View Camera', 'Adaptive Cruise Control', 'Privacy Glass', 'Leather Wrap Wheel', 'Leather Interior', 'Tilt Steering', 'Rear Defroster', 'Navigation System', 'Cruise Control', 'Panoramic Sunroof', 'Security System', 'Power Windows', 'Climate Control', 'Passenger Airbag', 'Stability Control', 'Wood Trim Interior', 'Trip Computer', 'Satellite Radio', 'Auto Dimming Mirrors', 'Auto On/Off Headlamps', 'Bucket Seats', 'Driver Side Airbag', 'Heated Steering Wheel', 'Lane Departure Warning', 'MP3 CD Player', 'Steering Wheel Audio Controls'], 'extraOption': 'Front Side Air Bag,Front Head Air Bag,Rear Head Air Bag,Multi-Zone A/C,ABS,4-Wheel Disc Brakes,Floor Mats,Heated Mirrors,Power Mirror(s),Pass-Through Rear Seat,Temporary Spare Tire,Aluminum Wheels,Generic Sun/Moonroof,Heated Front Seat(s),Immobilizer,Integrated Turn Signal Mirrors,Driver Vanity Mirror,Passenger Vanity Mirror,Mirror Memory,Driver Adjustable Lumbar,Tire Pressure Monitor,Universal Garage Door Opener,Bluetooth Connection,Telematics,Remote Engine Start,Back-Up Camera,Brake Assist,Keyless Start,Auxiliary Audio Input,Heated Rear Seat(s),Cargo Shade,Rear Bench Seat,Passenger Air Bag Sensor,Blind Spot Monitor,Hands-Free Liftgate,Cross-Traffic Alert,Lane Keeping Assist,Smart Device Integration,Front Collision Mitigation,Automatic Highbeams,LED Headlights,Requires Subscription,Driver Monitoring', 'dataLayerSectionName': 'features', 'order': 150, 'navigationAnchorName': 'vdp-options-widget', 'navigationTitle': 'Features &'}","Touring - AWD, Leather, Sunroof, Tow PKG, Alloys",Coldbrook,,PP3914,Top Notch Auto Sales II,Average,8.7,7.2,8.0,140.9,"{'specs': [{'key': 'Kilometres', 'value': '203,586 km'}, {'key': 'Status', 'value': 'Used'}, {'key': 'Trim', 'value': 'Touring - AWD, Leather, Sunroof, Tow PKG, Alloys'}, {'key': 'Body Type', 'value': 'SUV'}, {'key': 'Engine', 'value': '4 Cylinder Engine 1.5L'}, {'key': 'Cylinder', 'value': '4'}, {'key': 'Transmission', 'value': 'Automatic'}, {'key': 'Drivetrain', 'value': 'AWD'}, {'key': 'Stock Number', 'value': 'PP3914'}, {'key': 'Exterior Colour', 'value': 'Dark Olive Metallic'}, {'key': 'Interior Colour', 'value': 'Black'}, {'key': 'Passengers', 'value': '5'}, {'key': 'Doors', 'value': '4'}, {'key': 'Fuel Type', 'value': 'Gas'}, {'key': 'City Fuel Economy', 'value': '8.7L/100km'}, {'key': 'Hwy Fuel Economy', 'value': '7.2L/100km'}], 'showMadeIn': True, 'madeIn': 'canadaFlag', 'dataLayerSectionName': 'specs', 'order': 110, 'navigationAnchorName': 'vdp-specs-widget', 'navigationTitle': 'Specs'}","[{'description': ""Based on the reputation of treating customers from all over the country with great customer service we believe that Top Notch is a great place to buy a used vehicle. We believe that the first purchase here at Top Notch will not be your last. The business was built on referrals and repeat business over many successful years. Fully inspected vehicle that passes a certification level MVI (Motor Vehicle Inspection) vehicles that pass the Nova Scotia standards for safety As-traded vehicles  vehicles for the do it  yourselfer Vehicles from $999 and up, a range for every buyer Vehicles on consignment  sell it yourself for a fee In-house financing/ a large range of banks and finance companies - for small loans or big, for great credit, credit that needs to be established, or for those that have had some bad luck in the past and need to be re-established Full range of protection packages and warranties for every vehicle sold We can give you one-on-one advice with one of our trained financial service managers Home deliveries/or pick-up We offer a locate service, meaning we will bring in a vehicle for you from out of town, out of province just for you. Car-proof upon request Full range of trade-in vehicles from new car dealers, vehicles bought off the street and vehicles bought at auction. We'll buy your vehicle whether or not you buy one from us \r\n\r\nWarranty:\r\n Fresh 2yr mvi!! No warranty\xa0""}]","This vehicle is <b>$77 BELOW MARKET (0%)</b>. It is compared to similar vehicles in the <b>Coldbrook</b> and adjacent area. It’s based on kilometres, year, make, model, trim, manufacturer certification, manufacturer packages, options, and much more.",,GoodPrice
https://www.autotrader.ca/a/honda/cr-v/halifax/nova%20scotia/5_62811230_ct2004116163848740/,2017 Honda CR-V,Honda,CR-V,2017,Lunar Silver Metallic,130388,KMT,18995,CAD,https://schema.org/InStock,Intercooled Turbo Regular Unleaded I-4 1.5 L/91,Gas,CVT,LX,"['Tilt Steering', 'All Wheel Drive', 'Telescoping Steering']","{'showModule': True, 'showAllOptions': False, 'highlights': ['Tilt Steering', 'All Wheel Drive', 'Telescoping Steering'], 'options': [], 'dataLayerSectionName': 'features', 'order': 150, 'navigationAnchorName': 'vdp-options-widget', 'navigationTitle': 'Features &'}","{'showModule': True, 'showAllOptions': False, 'highlights': ['Tilt Steering', 'All Wheel Drive', 'Telescoping Steering'], 'options': [], 'dataLayerSectionName': 'features', 'order': 150, 'navigationAnchorName': 'vdp-options-widget', 'navigationTitle': 'Features &'}",LX,Halifax,,N362268A,Steele Subaru,Average,8.7,7.2,8.0,140.9,"{'specs': [{'key': 'Kilometres', 'value': '130,388 km'}, {'key': 'Status', 'value': 'Used'}, {'key': 'Trim', 'value': 'LX'}, {'key': 'Body Type', 'value': 'SUV'}, {'key': 'Engine', 'value': 'Intercooled Turbo Regular Unleaded I-4 1.5 L/91'}, {'key': 'Cylinder', 'value': '4'}, {'key': 'Transmission', 'value': 'CVT'}, {'key': 'Drivetrain', 'value': 'AWD'}, {'key': 'Stock Number', 'value': 'N362268A'}, {'key': 'Exterior Colour', 'value': 'Lunar Silver Metallic'}, {'key': 'Passengers', 'value': '5'}, {'key': 'Doors', 'value': '4'}, {'key': 'Fuel Type', 'value': 'Gas'}, {'key': 'City Fuel Economy', 'value': '8.7L/100km'}, {'key': 'Hwy Fuel Economy', 'value': '7.2L/100km'}], 'showMadeIn': True, 'madeIn': 'canadaFlag', 'dataLayerSectionName': 'specs', 'order': 110, 'navigationAnchorName': 'vdp-specs-widget', 'navigationTitle': 'Specs'}","[{'description': ""Awards:\n  * JD Power Canada Automotive Performance, Execution and Layout (APEAL) Study   * ALG Canada Residual Value Awards Silver 2017 Honda CR-V LX AWD CVT 1.5L I4 Turbocharged DOHC 16V LEV3-ULEV70 190hp Atlantic Canada's largest Subaru dealer.\n\nAll Wheel Drive, AWD, Apple CarPlay/Android Auto, Auto High-beam Headlights, Automatic temperature control, Exterior Parking Camera Rear, Forward collision: Collision Mitigation Braking System (CMBS) + FCW mitigation, Front dual zone A/C, Fully automatic headlights, Heated front seats, Lane departure: Lane Keeping Assist System (LKAS) active, Steering wheel mounted audio controls, Telescoping steering wheel, Tilt steering wheel.\n\n\nWE MAKE IT EASY!\n\nReviews:\n  * Owners tend to comment positively on ride quality, overall comfort, versatility, flexibility, roominess, and good fuel efficiency. The CR-V, when equipped with proper winter tires, is a confident and sure-footed performer in winter months, and several upscale design touches throughout the handy and accommodating cabin were also highly rated. Source: autoTRADER.ca ""}]","This vehicle is <b>$1,754 BELOW MARKET (8%)</b>. It is compared to similar vehicles in the <b>Halifax</b> and adjacent area. It’s based on kilometres, year, make, model, trim, manufacturer certification, manufacturer packages, options, and much more.",,GreatPrice
