url,name,make,model,year,color,mileage,mileage_unit,price,price_currency,availability,engine_type,fuel_type,transmission,vehicle_configuration,highlight_items,feature_highlights,feature_options,trim,location,vehicle_age,stock_number,dealer_name,mileage_analysis,fuel_economy_city,fuel_economy_highway,fuel_economy_combined,fuel_cost_cents_per_litre,specs,description,price_analysis,price_analysis_market_price,price_analysis_evaluation
https://www.autotrader.ca/a/honda/cr-v/bridgewater/nova%20scotia/5_63862752_ct20031222121652416/,2019 Honda CR-V,Honda,CR-V,2019,Molten Lava Pearl,82314,KMT,27995,CAD,https://schema.org/InStock,Intercooled Turbo Regular Unleaded I-4 1.5 L/91,Gas,CVT,EX-L,"['Keyless Entry', 'Rear Window Wiper', 'All Wheel Drive', 'Traction Control']","{'showModule': True, 'showAllOptions': False, 'highlights': ['Keyless Entry', 'Rear Window Wiper', 'All Wheel Drive', 'Traction Control', 'Fog Lights', 'Power Windows'], 'options': ['Rear View Camera', 'Remote Start', 'Stability Control', 'Bucket Seats', 'Power Steering', 'Alloy Wheels'], 'dataLayerSectionName': 'features', 'order': 150, 'navigationAnchorName': 'vdp-options-widget', 'navigationTitle': 'Features &'}","{'showModule': True, 'showAllOptions': False, 'highlights': ['Keyless Entry', 'Rear Window Wiper', 'All Wheel Drive', 'Traction Control', 'Fog Lights', 'Power Windows'], 'options': ['Rear View Camera', 'Remote Start', 'Stability Control', 'Bucket Seats', 'Power Steering', 'Alloy Wheels'], 'dataLayerSectionName': 'features', 'order': 150, 'navigationAnchorName': 'vdp-options-widget', 'navigationTitle': 'Features &'}",EX-L,Bridgewater,,PA0412,Bridgewater Honda,Average,8.7,7.2,8.0,140.9,"{'specs': [{'key': 'Kilometres', 'value': '82,314 km'}, {'key': 'Status', 'value': 'Used'}, {'key': 'Trim', 'value': 'EX-L'}, {'key': 'Body Type', 'value': 'SUV'}, {'key': 'Engine', 'value': 'Intercooled Turbo Regular Unleaded I-4 1.5 L/91'}, {'key': 'Cylinder', 'value': '4'}, {'key': 'Transmission', 'value': 'CVT'}, {'key': 'Drivetrain', 'value': 'AWD'}, {'key': 'Stock Number', 'value': 'PA0412'}, {'key': 'Exterior Colour', 'value': 'Molten Lava Pearl'}, {'key': 'Interior Colour', 'value': 'Black'}, {'key': 'Passengers', 'value': '5'}, {'key': 'Doors', 'value': '4'}, {'key': 'Fuel Type', 'value': 'Gas'}, {'key': 'City Fuel Economy', 'value': '8.7L/100km'}, {'key': 'Hwy Fuel Economy', 'value': '7.2L/100km'}], 'showMadeIn': True, 'madeIn': 'canadaFlag', 'dataLayerSectionName': 'specs', 'order': 110, 'navigationAnchorName': 'vdp-specs-widget', 'navigationTitle': 'Specs'}","[{'description': 'Awards:\n  * ALG Canada Residual Value Awards Recent Arrival! Odometer is 9111 kilometers below market average! Molten Lava Pearl 2019 Honda CR-V EX-L AWD CVT 1.5L I4 Turbocharged DOHC 16V LEV3-ULEV70 190hp Bridgewater Honda, Located in Bridgewater Nova Scotia.\n\nRemote Starter, AWD, 18 Aluminum Alloy Wheels, 4-Wheel Disc Brakes, 5.64 Axle Ratio, 8 Speakers, Air Conditioning, Apple CarPlay/Android Auto, Auto High-beam Headlights, Auto-dimming Rear-View mirror, Automatic temperature control, Backup Camera, Brake assist, Bumpers: body-colour, Cruise Control, Delay-off headlights, Electronic Stability Control, Forward collision: Collision Mitigation Braking System (CMBS) + FCW mitigation, Four wheel independent suspension, Front dual zone A/C, Front fog lights, Fully automatic headlights, Heated Front Bucket Seats, Heated rear seats, Lane departure: Lane Keeping Assist System (LKAS) active, Leather Shift Knob, Memory seat, Perforated Leather-Trimmed Seating Surfaces, Power door mirrors, Power driver seat, Power Liftgate, Power passenger seat, Power steering, Power windows, Radio: 180-Watt AM/FM Audio System, Rear window defroster, Rear window wiper, Remote keyless entry, SiriusXM, Speed-sensing steering, Speed-Sensitive Wipers, Split folding rear seat, Spoiler, Steering wheel mounted audio controls, Traction control, Turn signal indicator mirrors. '}]","This vehicle is <b>$849 BELOW MARKET (2%)</b>. It is compared to similar vehicles in the <b>Bridgewater</b> and adjacent area. It’s based on kilometres, year, make, model, trim, manufacturer certification, manufacturer packages, options, and much more.",,GoodPrice
https://www.autotrader.ca/a/honda/cr-v/bedford/nova%20scotia/5_63889773_20171108140002288/,2021 Honda CR-V,Honda,CR-V,2021,Crystal Black Pearl,75270,KMT,25790,CAD,https://schema.org/InStock,4 Cylinder Engine,Gas,Automatic,"LX AWD w/ Apple CarPlay & Android Auto, Rearview C","['All Wheel Drive', 'Heated Seats', 'One Owner', 'Accident Free']","{'showModule': True, 'showAllOptions': True, 'highlights': ['All Wheel Drive', 'Heated Seats', 'Adaptive Cruise Control', 'Rear View Camera', 'Bluetooth', 'Remote Start'], 'options': [], 'extraOption': 'Auto High Beam ,Apple CarPlay & Android Auto,7 Display Audio System,Honda Sensing Technologies,Road Departure Mitigation System ,ECON Mode Button,Lane Departure Warning ,Rearview Camera,Dual-Zone A/C,Collision Mitigation Braking System ,Adaptive Cruise Control w/ Low Speed Follow,Proximity Key With Push Button Start ,Forward Collision Warning System ,Lane Keeping Assist System ,Remote Engine Start,Projector Beam Halogen Headlights w/ Auto On/Off', 'dataLayerSectionName': 'features', 'order': 150, 'navigationAnchorName': 'vdp-options-widget', 'navigationTitle': 'Features &'}","{'showModule': True, 'showAllOptions': True, 'highlights': ['All Wheel Drive', 'Heated Seats', 'Adaptive Cruise Control', 'Rear View Camera', 'Bluetooth', 'Remote Start'], 'options': [], 'extraOption': 'Auto High Beam ,Apple CarPlay & Android Auto,7 Display Audio System,Honda Sensing Technologies,Road Departure Mitigation System ,ECON Mode Button,Lane Departure Warning ,Rearview Camera,Dual-Zone A/C,Collision Mitigation Braking System ,Adaptive Cruise Control w/ Low Speed Follow,Proximity Key With Push Button Start ,Forward Collision Warning System ,Lane Keeping Assist System ,Remote Engine Start,Projector Beam Halogen Headlights w/ Auto On/Off', 'dataLayerSectionName': 'features', 'order': 150, 'navigationAnchorName': 'vdp-options-widget', 'navigationTitle': 'Features &'}","LX AWD w/ Apple CarPlay & Android Auto, Rearview C",Bedford,,36178-6,Clutch,Average,8.7,7.4,8.1,140.9,"{'specs': [{'key': 'Kilometres', 'value': '75,270 km'}, {'key': 'Status', 'value': 'Used'}, {'key': 'Trim', 'value': 'LX AWD w/ Apple CarPlay & Android Auto, Rearview C'}, {'key': 'Body Type', 'value': 'SUV'}, {'key': 'Engine', 'value': '4 Cylinder Engine'}, {'key': 'Cylinder', 'value': '4'}, {'key': 'Transmission', 'value': 'Automatic'}, {'key': 'Drivetrain', 'value': 'AWD'}, {'key': 'Stock Number', 'value': '36178-6'}, {'key': 'Exterior Colour', 'value': 'Crystal Black Pearl'}, {'key': 'Interior Colour', 'value': 'Black'}, {'key': 'Passengers', 'value': '5'}, {'key': 'Doors', 'value': '4'}, {'key': 'Fuel Type', 'value': 'Gas'}, {'key': 'City Fuel Economy', 'value': '8.7L/100km'}, {'key': 'Hwy Fuel Economy', 'value': '7.4L/100km'}], 'showMadeIn': True, 'madeIn': 'canadaFlag', 'dataLayerSectionName': 'specs', 'order': 110, 'navigationAnchorName': 'vdp-specs-widget', 'navigationTitle': 'Specs'}","[{'description': ""NO ACCIDENTS / CLEAN CARFAX / 1 OWNER / Auto High Beam , Bluetooth, Apple CarPlay & Android Auto and more!\n \nClutch is the largest online used car retailer in Canada, delivering a seamless, hassle-free car-buying experience to drivers everywhere. Shop hundreds of used cars online, get the right one delivered to your door, and enjoy peace of mind with our optional 10-Day Money-Back Guarantee. How sweet is that? To learn more, visit clutch.ca.\n \nThe top features for this 2021 Honda CR-V include:\n \nAuto High Beam\nBluetooth\nApple CarPlay & Android Auto\n7 Display Audio System\nHonda Sensing Technologies\nRoad Departure Mitigation System\nECON Mode Button\nHeated Front Seats\n \nSeamless home delivery - Delivery anywhere in Nova Scotia, anywhere on PEI, and East of Fredericton, New Brunswick. Available on select packages.\n \nTry it out for 10 days - If you do not like it, we will take it back. Available on select packages.\n \nQuality assured - Rigorous 210-point inspection and reconditioning process.\n \n\nPeace of mind - Optional 3-month Standard Warranty, with additional warranty options available. Plus, every Clutch car comes with a 2-year MVI.\n \nHaggle-free - No haggling or hard sells.\n \n100% Transparency - Full inspection reports on every car, including high-res photography and a free Carfax report.\n \nListed price is for cash purchase only and does not include taxes, Shipping Fees (if applicable), Delivery Fees (if applicable), government licensing fees. 10-day Money Back Guarantee, 3-month Standard Warranty, and home delivery are available with select packages.\n \nPrevious Provincial Registrations:\nOntario\n \nStock # 36178 \r\n\r\nWarranty:\r\nThis vehicle's manufacturer warranty has expired.""}]","This vehicle is <b>$3,846 BELOW MARKET (12%)</b>. It is compared to similar vehicles in the <b>Bedford</b> and adjacent area. It’s based on kilometres, year, make, model, trim, manufacturer certification, manufacturer packages, options, and much more.",,GreatPrice
https://www.autotrader.ca/a/honda/cr-v/kentville/nova%20scotia/5_63776017_20160729153451854/,2020 Honda CR-V,Honda,CR-V,2020,Modern Steel Metallic,70994,KMT,25490,CAD,https://schema.org/InStock,LIGHT/MEDIUM DUTY,Gas,Automatic,"LX - cruise cotrol, reverse camera, a/c hands free",[],"{'showModule': False, 'showAllOptions': False, 'dataLayerSectionName': 'features', 'order': 150, 'navigationAnchorName': 'vdp-options-widget', 'navigationTitle': 'Features &'}","{'showModule': False, 'showAllOptions': False, 'dataLayerSectionName': 'features', 'order': 150, 'navigationAnchorName': 'vdp-options-widget', 'navigationTitle': 'Features &'}","LX - cruise cotrol, reverse camera, a/c hands free",Kentville,,P4044,Kings County Honda,Average,8.3,7.0,7.7,140.9,"{'specs': [{'key': 'Kilometres', 'value': '70,994 km'}, {'key': 'Status', 'value': 'Used'}, {'key': 'Trim', 'value': 'LX - cruise cotrol, reverse camera, a/c hands free'}, {'key': 'Body Type', 'value': 'SUV'}, {'key': 'Engine', 'value': 'LIGHT/MEDIUM DUTY'}, {'key': 'Cylinder', 'value': '4'}, {'key': 'Transmission', 'value': 'Automatic'}, {'key': 'Drivetrain', 'value': 'FWD'}, {'key': 'Stock Number', 'value': 'P4044'}, {'key': 'Exterior Colour', 'value': 'Modern Steel Metallic'}, {'key': 'Interior Colour', 'value': 'Black'}, {'key': 'Passengers', 'value': '5'}, {'key': 'Doors', 'value': '4'}, {'key': 'Fuel Type', 'value': 'Gas'}, {'key': 'City Fuel Economy', 'value': '8.3L/100km'}, {'key': 'Hwy Fuel Economy', 'value': '7.0L/100km'}], 'showMadeIn': True, 'madeIn': 'canadaFlag', 'dataLayerSectionName': 'specs', 'order': 110, 'navigationAnchorName': 'vdp-specs-widget', 'navigationTitle': 'Specs'}","[{'description': ""          At Kings Honda you will experience an outstanding car buying experience. We make every effort to exceed your expectations. TheKings Hondateam listens to you to offer a personalized and unique customer service. All our vehicles are in excellent mechanical and aesthetic condition and offer attractive warranties.Kings Hondaoffers the complete collection of new Honda vehicles and a wide selection of used vehicles at the best prices. Whatever your budget,Kings Hondawill help you find a vehicle that suits you. A long-standing member of the community we serve, and a business firmly committed to providing, friendly, relaxed, down-home service to our valued clientele, Kings Honda is happy to hear from you with any questions or comments you may have about our Honda products and services. \r\n\r\nWarranty:\r\n Honda Certified Used Vehicles are highly sought after thanks to Honda's legendary reputation for durability, quality, and reliability. In order to earn the distinction of Honda Certified, each used Honda vehicle must pass a series of strict Honda Canada ""}]","This vehicle is <b>$1,480 BELOW MARKET (5%)</b>. It is compared to similar vehicles in the <b>Kentville</b> and adjacent area. It’s based on kilometres, year, make, model, trim, manufacturer certification, manufacturer packages, options, and much more.",,GreatPrice
https://www.autotrader.ca/a/honda/cr-v/dartmouth/nova%20scotia/5_63630626_20150813141013738/,2013 Honda CR-V,Honda,CR-V,2013,,221334,KMT,11999,CAD,https://schema.org/InStock,Gas I4 2.4L/144,Gas,Automatic,EX-L,[],"{'showModule': False, 'showAllOptions': False, 'dataLayerSectionName': 'features', 'order': 150, 'navigationAnchorName': 'vdp-options-widget', 'navigationTitle': 'Features &'}","{'showModule': False, 'showAllOptions': False, 'dataLayerSectionName': 'features', 'order': 150, 'navigationAnchorName': 'vdp-options-widget', 'navigationTitle': 'Features &'}",EX-L,Dartmouth,,N190728AA,Steele Chevrolet Buick GMC Cadillac,Average,9.2,6.6,8.0,140.9,"{'specs': [{'key': 'Kilometres', 'value': '221,334 km'}, {'key': 'Status', 'value': 'Used'}, {'key': 'Trim', 'value': 'EX-L'}, {'key': 'Body Type', 'value': 'SUV'}, {'key': 'Engine', 'value': 'Gas I4 2.4L/144'}, {'key': 'Cylinder', 'value': '4'}, {'key': 'Transmission', 'value': 'Automatic'}, {'key': 'Drivetrain', 'value': 'AWD'}, {'key': 'Stock Number', 'value': 'N190728AA'}, {'key': 'Passengers', 'value': '5'}, {'key': 'Doors', 'value': '4'}, {'key': 'Fuel Type', 'value': 'Gas'}, {'key': 'City Fuel Economy', 'value': '9.2L/100km'}, {'key': 'Hwy Fuel Economy', 'value': '6.6L/100km'}], 'showMadeIn': True, 'madeIn': 'canadaFlag', 'dataLayerSectionName': 'specs', 'order': 110, 'navigationAnchorName': 'vdp-specs-widget', 'navigationTitle': 'Specs'}",[],"This vehicle is <b>$126 ABOVE MARKET (1%)</b>. It is compared to similar vehicles in the <b>Dartmouth</b> and adjacent area. It’s based on kilometres, year, make, model, trim, manufacturer certification, manufacturer packages, options, and much more.",,FairPrice
https://www.autotrader.ca/a/honda/cr-v/coldbrook/nova%20scotia/5_63835178_20160729155632808/,2011 Honda CR-V,Honda,CR-V,2011,Brown,183656,KMT,7491,CAD,https://schema.org/InStock,UNKNOWN,Gas,Automatic,"EX-L, Sunroof, Power Seats, Cruise Control","['Intermittent Wipers', 'Heated Mirrors', 'Keyless Entry', 'Sold As-Is']","{'showModule': True, 'showAllOptions': True, 'highlights': ['Intermittent Wipers', 'Heated Mirrors', 'Keyless Entry', 'Premium Audio', 'CD Player', 'Power Locks'], 'options': ['Air Conditioning', 'Power Steering', 'Traction Control', 'AM/FM Stereo', 'Child-Safety Locks', 'Power Seat', 'Anti-Lock Brakes (ABS)', 'Privacy Glass', 'Leather Wrap Wheel', 'Leather Interior', 'Tilt Steering', 'Rear Defroster', 'Cruise Control', 'Security System', 'Power Windows', 'Climate Control', 'Passenger Airbag', 'Stability Control', 'Satellite Radio', 'Auto On/Off Headlamps', 'Bucket Seats', 'CD Changer', 'Driver Side Airbag', 'Steering Wheel Audio Controls'], 'extraOption': 'Front Side Air Bag,Front Head Air Bag,Rear Head Air Bag,Multi-Zone A/C,ABS,4-Wheel Disc Brakes,Floor Mats,Heated Mirrors,Power Mirror(s),Sun/Moonroof,Pass-Through Rear Seat,Aluminum Wheels,Generic Sun/Moonroof,MP3 Capability,Heated Front Seat(s),Power Outlet,Immobilizer,Front Reading Lamps,Tire Pressure Monitor,Auxiliary Audio Input,Rear Bench Seat,Passenger Air Bag Sensor,Requires Subscription', 'dataLayerSectionName': 'features', 'order': 150, 'navigationAnchorName': 'vdp-options-widget', 'navigationTitle': 'Features &'}","{'showModule': True, 'showAllOptions': True, 'highlights': ['Intermittent Wipers', 'Heated Mirrors', 'Keyless Entry', 'Premium Audio', 'CD Player', 'Power Locks'], 'options': ['Air Conditioning', 'Power Steering', 'Traction Control', 'AM/FM Stereo', 'Child-Safety Locks', 'Power Seat', 'Anti-Lock Brakes (ABS)', 'Privacy Glass', 'Leather Wrap Wheel', 'Leather Interior', 'Tilt Steering', 'Rear Defroster', 'Cruise Control', 'Security System', 'Power Windows', 'Climate Control', 'Passenger Airbag', 'Stability Control', 'Satellite Radio', 'Auto On/Off Headlamps', 'Bucket Seats', 'CD Changer', 'Driver Side Airbag', 'Steering Wheel Audio Controls'], 'extraOption': 'Front Side Air Bag,Front Head Air Bag,Rear Head Air Bag,Multi-Zone A/C,ABS,4-Wheel Disc Brakes,Floor Mats,Heated Mirrors,Power Mirror(s),Sun/Moonroof,Pass-Through Rear Seat,Aluminum Wheels,Generic Sun/Moonroof,MP3 Capability,Heated Front Seat(s),Power Outlet,Immobilizer,Front Reading Lamps,Tire Pressure Monitor,Auxiliary Audio Input,Rear Bench Seat,Passenger Air Bag Sensor,Requires Subscription', 'dataLayerSectionName': 'features', 'order': 150, 'navigationAnchorName': 'vdp-options-widget', 'navigationTitle': 'Features &'}","EX-L, Sunroof, Power Seats, Cruise Control",Coldbrook,,P3984A,Top Notch Auto Sales II,Average,10.1,7.5,8.9,140.9,"{'specs': [{'key': 'Kilometres', 'value': '183,656 km'}, {'key': 'Status', 'value': 'Used'}, {'key': 'Trim', 'value': 'EX-L, Sunroof, Power Seats, Cruise Control'}, {'key': 'Body Type', 'value': 'SUV'}, {'key': 'Engine', 'value': 'UNKNOWN'}, {'key': 'Cylinder', 'value': '4'}, {'key': 'Transmission', 'value': 'Automatic'}, {'key': 'Drivetrain', 'value': '4x4'}, {'key': 'Stock Number', 'value': 'P3984A'}, {'key': 'Exterior Colour', 'value': 'Brown'}, {'key': 'Interior Colour', 'value': 'Grey'}, {'key': 'Passengers', 'value': '5'}, {'key': 'Doors', 'value': '4'}, {'key': 'Fuel Type', 'value': 'Gas'}, {'key': 'City Fuel Economy', 'value': '10.1L/100km'}, {'key': 'Hwy Fuel Economy', 'value': '7.5L/100km'}], 'showMadeIn': False, 'dataLayerSectionName': 'specs', 'order': 110, 'navigationAnchorName': 'vdp-specs-widget', 'navigationTitle': 'Specs'}","[{'description': 'AS TRADED USED CAR POLICY: All vehicles sold As-is Wher-is are sold with no warranty implied or expressed. As-Is vehicles do not come with MVI Inspection. MVI sticker is removed at the time of sale or delivery. We encurage all customers to take any vehicle for inspection to a certified inspection station prior to purchase, at their convenience. All pricing is at or below wholesale. No inspection. No warranty or Exchange. all sales final/no refunds. \r\n\r\nWarranty:\r\nClass D : No warranty'}]",,,
https://www.autotrader.ca/a/honda/cr-v/bedford/nova%20scotia/5_63505429_20171108140002288/,2018 Honda CR-V,Honda,CR-V,2018,Black,77939,KMT,25290,CAD,https://schema.org/InStock,4 Cylinder Engine,Gas,Automatic,"Touring AWD w/ Apple CarPlay, Panoramic Moonroof, ","['Heated Mirrors', 'Hill Ascent Control', 'Accident Free', 'Multi Point Inspection']","{'showModule': True, 'showAllOptions': True, 'highlights': ['Heated Mirrors', 'Hill Ascent Control', 'Rain Sensor Wipers', 'Navigation System', 'All Wheel Drive', 'Heated Seats'], 'options': ['Adaptive Cruise Control', 'Rear View Camera', 'Bluetooth', 'Remote Start', 'Memory Seats', 'Power Seat', 'Daytime Running Lights', 'Auto Dimming Mirrors', 'Heated Steering Wheel'], 'extraOption': 'Adaptive Cruise Control w/ Low-Speed Follow,7 Display Audio System ,Panoramic Moonroof,Navigation,Lane Keeping Assist System ,Apple CarPlay & Android Auto,Hands Free Power Tailgate ,LED Daytime Running Lights,Forward Collision Warning ,USB Ports ,Rearview Camera,LED Auto On/Off Headlights ,ECON Mode Button,Remote Engine Start,Proximity Key Entry System w/ Push Button Start ,Auto High Beam ,Garage Door Opener,9-Speakers,Lane Departure Warning ,Blind Spot Information System w/ Rear Cross Traffic Monitor System ,Heated Rear Seats,Ambient Lighting,Collision Mitigation Braking System ,Road Departure Mitigation System', 'dataLayerSectionName': 'features', 'order': 150, 'navigationAnchorName': 'vdp-options-widget', 'navigationTitle': 'Features &'}","{'showModule': True, 'showAllOptions': True, 'highlights': ['Heated Mirrors', 'Hill Ascent Control', 'Rain Sensor Wipers', 'Navigation System', 'All Wheel Drive', 'Heated Seats'], 'options': ['Adaptive Cruise Control', 'Rear View Camera', 'Bluetooth', 'Remote Start', 'Memory Seats', 'Power Seat', 'Daytime Running Lights', 'Auto Dimming Mirrors', 'Heated Steering Wheel'], 'extraOption': 'Adaptive Cruise Control w/ Low-Speed Follow,7 Display Audio System ,Panoramic Moonroof,Navigation,Lane Keeping Assist System ,Apple CarPlay & Android Auto,Hands Free Power Tailgate ,LED Daytime Running Lights,Forward Collision Warning ,USB Ports ,Rearview Camera,LED Auto On/Off Headlights ,ECON Mode Button,Remote Engine Start,Proximity Key Entry System w/ Push Button Start ,Auto High Beam ,Garage Door Opener,9-Speakers,Lane Departure Warning ,Blind Spot Information System w/ Rear Cross Traffic Monitor System ,Heated Rear Seats,Ambient Lighting,Collision Mitigation Braking System ,Road Departure Mitigation System', 'dataLayerSectionName': 'features', 'order': 150, 'navigationAnchorName': 'vdp-options-widget', 'navigationTitle': 'Features &'}","Touring AWD w/ Apple CarPlay, Panoramic Moonroof, ",Bedford,,34284-6,Clutch,Low,8.7,7.2,8.0,140.9,"{'specs': [{'key': 'Kilometres', 'value': '77,939 km'}, {'key': 'Status', 'value': 'Used'}, {'key': 'Trim', 'value': 'Touring AWD w/ Apple CarPlay, Panoramic Moonroof, '}, {'key': 'Body Type', 'value': 'SUV'}, {'key': 'Engine', 'value': '4 Cylinder Engine'}, {'key': 'Cylinder', 'value': '4'}, {'key': 'Transmission', 'value': 'Automatic'}, {'key': 'Drivetrain', 'value': 'AWD'}, {'key': 'Stock Number', 'value': '34284-6'}, {'key': 'Exterior Colour', 'value': 'Black'}, {'key': 'Interior Colour', 'value': 'Black'}, {'key': 'Passengers', 'value': '5'}, {'key': 'Doors', 'value': '4'}, {'key': 'Fuel Type', 'value': 'Gas'}, {'key': 'City Fuel Economy', 'value': '8.7L/100km'}, {'key': 'Hwy Fuel Economy', 'value': '7.2L/100km'}], 'showMadeIn': True, 'madeIn': 'canadaFlag', 'dataLayerSectionName': 'specs', 'order': 110, 'navigationAnchorName': 'vdp-specs-widget', 'navigationTitle': 'Specs'}","[{'description': ""NO ACCIDENTS / CLEAN CARFAX / Adaptive Cruise Control w/ Low-Speed Follow, 7 Display Audio System , Driver's Memory Seat and more!\n \nClutch is the largest online used car retailer in Canada, delivering a seamless, hassle-free car-buying experience to drivers everywhere. Shop hundreds of used cars online, get the right one delivered to your door, and enjoy peace of mind with our optional 10-Day Money-Back Guarantee. How sweet is that? To learn more, visit clutch.ca.\n \nThe top features for this 2018 Honda CR-V include:\n \nAdaptive Cruise Control w/ Low-Speed Follow\n7 Display Audio System\nDriver's Memory Seat\nHill Start Assist\nPanoramic Moonroof\nNavigation\nLane Keeping Assist System\nApple CarPlay & Android Auto\n \nSeamless home delivery - Delivery anywhere in Nova Scotia, anywhere on PEI, and East of Fredericton, New Brunswick. Available on select packages.\n \nTry it out for 10 days - If you do not like it, we will take it back. Available on select packages.\n \nQuality assured - Rigorous 210-point inspection and reconditioning process.\n \nPeace of mind - Optional 3-month Standard Warranty, with additional warranty options available. Plus, every Clutch car comes with a 2-year MVI.\n \nHaggle-free - No haggling or hard sells.\n \n100% Transparency - Full inspection reports on every car, including high-res photography and a free Carfax report.\n \nListed price is for cash purchase only and does not include taxes, Shipping Fees (if applicable), Delivery Fees (if applicable), government licensing fees. 10-day Money Back Guarantee, 3-month Standard Warranty, and home delivery are available with select packages.\n \nPrevious Provincial Registrations:\nOntario\n \nStock # 34284 \r\n\r\nWarranty:\r\nThis vehicle's manufacturer warranty has expired.""}]","This vehicle is <b>$3,198 BELOW MARKET (11%)</b>. It is compared to similar vehicles in the <b>Bedford</b> and adjacent area. It’s based on kilometres, year, make, model, trim, manufacturer certification, manufacturer packages, options, and much more.",,GreatPrice
