url,name,make,model,year,color,mileage,mileage_unit,price,price_currency,availability,engine_type,fuel_type,transmission,vehicle_configuration,highlight_items,feature_highlights,feature_options,trim,location,vehicle_age,stock_number,dealer_name,mileage_analysis,fuel_economy_city,fuel_economy_highway,fuel_economy_combined,fuel_cost_cents_per_litre,specs,description,price_analysis,price_analysis_market_price,price_analysis_evaluation
https://www.autotrader.ca/a/honda/cr-v/bridgewater/nova%20scotia/5_63595211_20171102184221347/,2022 Honda CR-V,Honda,CR-V,2022,Radiant Red Metallic,68339,KMT,32988,CAD,https://schema.org/InStock,Intercooled Turbo Regular Unleaded I-4 1.5 L/91,Gas,CVT,"For Sale, Bridgewater","['Tilt Steering', 'Intermittent Wipers', 'Keyless Entry', 'Telescoping Steering']","{'showModule': True, 'showAllOptions': False, 'highlights': ['Tilt Steering', 'Intermittent Wipers', 'Keyless Entry', 'Telescoping Steering', 'All Wheel Drive', 'Traction Control'], 'options': ['Security System', 'Fog Lights', 'Power Windows', 'Stability Control', 'Trip Computer', 'Bucket Seats', 'Power Steering', 'Anti-Lock Brakes (ABS)', 'Alloy Wheels'], 'dataLayerSectionName': 'features', 'order': 150, 'navigationAnchorName': 'vdp-options-widget', 'navigationTitle': 'Features &'}","{'showModule': True, 'showAllOptions': False, 'highlights': ['Tilt Steering', 'Intermittent Wipers', 'Keyless Entry', 'Telescoping Steering', 'All Wheel Drive', 'Traction Control'], 'options': ['Security System', 'Fog Lights', 'Power Windows', 'Stability Control', 'Trip Computer', 'Bucket Seats', 'Power Steering', 'Anti-Lock Brakes (ABS)', 'Alloy Wheels'], 'dataLayerSectionName': 'features', 'order': 150, 'navigationAnchorName': 'vdp-options-widget', 'navigationTitle': 'Features &'}","For Sale, Bridgewater",Bridgewater,,S26744,South Shore Chevrolet,Average,8.7,7.4,8.1,140.9,"{'specs': [{'key': 'Kilometres', 'value': '68,339 km'}, {'key': 'Status', 'value': 'Used'}, {'key': 'Trim', 'value': 'For Sale, Bridgewater'}, {'key': 'Body Type', 'value': 'SUV'}, {'key': 'Engine', 'value': 'Intercooled Turbo Regular Unleaded I-4 1.5 L/91'}, {'key': 'Cylinder', 'value': '4'}, {'key': 'Transmission', 'value': 'CVT'}, {'key': 'Drivetrain', 'value': 'AWD'}, {'key': 'Stock Number', 'value': 'S26744'}, {'key': 'Exterior Colour', 'value': 'Radiant Red Metallic'}, {'key': 'Passengers', 'value': '5'}, {'key': 'Doors', 'value': '4'}, {'key': 'Fuel Type', 'value': 'Gas'}, {'key': 'City Fuel Economy', 'value': '8.7L/100km'}, {'key': 'Hwy Fuel Economy', 'value': '7.4L/100km'}], 'showMadeIn': True, 'madeIn': 'canadaFlag', 'dataLayerSectionName': 'specs', 'order': 110, 'navigationAnchorName': 'vdp-specs-widget', 'navigationTitle': 'Specs'}","[{'description': 'Recent Arrival! Red 2022 Honda CR-V EX-L For Sale, Bridgewater AWD CVT 1.5L I4 Turbocharged DOHC 16V LEV3-ULEV50 190hp Clean Car Fax, AWD, 8 Speakers, ABS brakes, Air Conditioning, Alloy wheels, Auto-dimming Rear-View mirror, Automatic temperature control, Brake assist, Delay-off headlights, Driver door bin, Driver vanity mirror, Dual front impact airbags, Electronic Stability Control, Exterior Parking Camera Rear, Forward collision: Collision Mitigation Braking System (CMBS) + FCW mitigation, Front dual zone A/C, Front fog lights, Heated door mirrors, Heated Front Bucket Seats, Heated front seats, Heated rear seats, Heated steering wheel, Illuminated entry, Memory seat, Occupant sensing airbag, Outside temperature display, Overhead airbag, Power door mirrors, Power driver seat, Power Liftgate, Power moonroof, Power steering, Power windows, Radio data system, Rear window defroster, Remote keyless entry, Security system, Speed control, Speed-sensing steering, Speed-Sensitive Wipers, Spoiler, Telescoping steering wheel, Tilt steering wheel, Traction control, Trip computer, Turn signal indicator mirrors, Variably intermittent wipers. '}]","This vehicle is <b>$1,779 BELOW MARKET (5%)</b>. It is compared to similar vehicles in the <b>Bridgewater</b> and adjacent area. It’s based on kilometres, year, make, model, trim, manufacturer certification, manufacturer packages, options, and much more.",,GreatPrice
https://www.autotrader.ca/a/honda/cr-v/coldbrook/nova%20scotia/5_63687416_20160729155632808/,2018 Honda CR-V,Honda,CR-V,2018,Grey,94702,KMT,24498,CAD,https://schema.org/InStock,1.5T,Gas,Automatic,"Touring, power seats, sunroof, reverse camera",[],"{'showModule': False, 'showAllOptions': False, 'dataLayerSectionName': 'features', 'order': 150, 'navigationAnchorName': 'vdp-options-widget', 'navigationTitle': 'Features &'}","{'showModule': False, 'showAllOptions': False, 'dataLayerSectionName': 'features', 'order': 150, 'navigationAnchorName': 'vdp-options-widget', 'navigationTitle': 'Features &'}","Touring, power seats, sunroof, reverse camera",Coldbrook,,25107A,Top Notch Auto Sales II,Average,8.7,7.2,8.0,140.9,"{'specs': [{'key': 'Kilometres', 'value': '94,702 km'}, {'key': 'Status', 'value': 'Used'}, {'key': 'Trim', 'value': 'Touring, power seats, sunroof, reverse camera'}, {'key': 'Body Type', 'value': 'SUV'}, {'key': 'Engine', 'value': '1.5T'}, {'key': 'Cylinder', 'value': '4'}, {'key': 'Transmission', 'value': 'Automatic'}, {'key': 'Drivetrain', 'value': 'AWD'}, {'key': 'Stock Number', 'value': '25107A'}, {'key': 'Exterior Colour', 'value': 'Grey'}, {'key': 'Interior Colour', 'value': 'Black'}, {'key': 'Passengers', 'value': '5'}, {'key': 'Doors', 'value': '4'}, {'key': 'Fuel Type', 'value': 'Gas'}, {'key': 'City Fuel Economy', 'value': '8.7L/100km'}, {'key': 'Hwy Fuel Economy', 'value': '7.2L/100km'}], 'showMadeIn': True, 'madeIn': 'canadaFlag', 'dataLayerSectionName': 'specs', 'order': 110, 'navigationAnchorName': 'vdp-specs-widget', 'navigationTitle': 'Specs'}","[{'description': ""Based on the reputation of treating customers from all over the country with great customer service we believe that Top Notch is a great place to buy a used vehicle. We believe that the first purchase here at Top Notch will not be your last. The business was built on referrals and repeat business over many successful years. Fully inspected vehicle that passes a certification level MVI (Motor Vehicle Inspection) vehicles that pass the Nova Scotia standards for safety As-traded vehicles  vehicles for the do it  yourselfer Vehicles from $999 and up, a range for every buyer Vehicles on consignment  sell it yourself for a fee In-house financing/ a large range of banks and finance companies - for small loans or big, for great credit, credit that needs to be established, or for those that have had some bad luck in the past and need to be re-established Full range of protection packages and warranties for every vehicle sold We can give you one-on-one advice with one of our trained financial service managers Home deliveries/or pick-up We offer a locate service, meaning we will bring in a vehicle for you from out of town, out of province just for you. Car-proof upon request Full range of trade-in vehicles from new car dealers, vehicles bought off the street and vehicles bought at auction. We'll buy your vehicle whether or not you buy one from us \r\n\r\nWarranty:\r\nClass B : 3 months or 5,000 km.  3 month/ 5,000km power train warranty for $299!\xa0""}]","This vehicle is <b>$2,928 BELOW MARKET (10%)</b>. It is compared to similar vehicles in the <b>Coldbrook</b> and adjacent area. It’s based on kilometres, year, make, model, trim, manufacturer certification, manufacturer packages, options, and much more.",,GreatPrice
https://www.autotrader.ca/a/honda/cr-v/dartmouth/nova%20scotia/5_62733757_20210804165103206/,2019 Honda CR-V,Honda,CR-V,2019,Crystal Black Pearl,123728,KMT,21994,CAD,https://schema.org/InStock,Intercooled Turbo Regular Unleaded I-4 1.5 L/91,Gas,CVT,LX,"['Intermittent Wipers', 'Heated Mirrors', 'Keyless Entry', 'All Wheel Drive']","{'showModule': True, 'showAllOptions': True, 'highlights': ['Intermittent Wipers', 'Heated Mirrors', 'Keyless Entry', 'All Wheel Drive', 'Power Locks', 'Air Conditioning'], 'options': ['Power Steering', 'Traction Control', 'AM/FM Stereo', 'Spoiler', 'Child-Safety Locks', 'Bluetooth', 'Remote Start', 'Daytime Running Lights', 'Anti-Lock Brakes (ABS)', 'Rear View Camera', 'Adaptive Cruise Control', 'Privacy Glass', 'Tilt Steering', 'Rear Defroster', 'Cruise Control', 'Security System', 'Power Windows', 'Climate Control', 'Cloth Interior', 'Passenger Airbag', 'Stability Control', 'Trip Computer', 'Auto On/Off Headlamps', 'Bucket Seats', 'Driver Side Airbag', 'Lane Departure Warning', 'Steering Wheel Audio Controls'], 'extraOption': 'Tires - Rear All-Season,Turbocharged,Power Mirror(s),ABS,Heated Mirrors,Brake Assist,4-Wheel Disc Brakes,Auxiliary Audio Input,Temporary Spare Tire,Tires - Front All-Season,Aluminum Wheels,Smart Device Integration,Bluetooth Connection,Automatic Highbeams,MP3 Capability,Driver Vanity Mirror,Keyless Start,Heated Front Seat(s),Back-Up Camera,Passenger Air Bag Sensor,Multi-Zone A/C,Rear Bench Seat,Floor Mats,Tire Pressure Monitor,Pass-Through Rear Seat,Rear Head Air Bag,Lane Keeping Assist,Driver Monitoring,Remote Engine Start,Immobilizer,Passenger Vanity Mirror,Front Side Air Bag,Front Head Air Bag,Front Collision Mitigation', 'dataLayerSectionName': 'features', 'order': 150, 'navigationAnchorName': 'vdp-options-widget', 'navigationTitle': 'Features &'}","{'showModule': True, 'showAllOptions': True, 'highlights': ['Intermittent Wipers', 'Heated Mirrors', 'Keyless Entry', 'All Wheel Drive', 'Power Locks', 'Air Conditioning'], 'options': ['Power Steering', 'Traction Control', 'AM/FM Stereo', 'Spoiler', 'Child-Safety Locks', 'Bluetooth', 'Remote Start', 'Daytime Running Lights', 'Anti-Lock Brakes (ABS)', 'Rear View Camera', 'Adaptive Cruise Control', 'Privacy Glass', 'Tilt Steering', 'Rear Defroster', 'Cruise Control', 'Security System', 'Power Windows', 'Climate Control', 'Cloth Interior', 'Passenger Airbag', 'Stability Control', 'Trip Computer', 'Auto On/Off Headlamps', 'Bucket Seats', 'Driver Side Airbag', 'Lane Departure Warning', 'Steering Wheel Audio Controls'], 'extraOption': 'Tires - Rear All-Season,Turbocharged,Power Mirror(s),ABS,Heated Mirrors,Brake Assist,4-Wheel Disc Brakes,Auxiliary Audio Input,Temporary Spare Tire,Tires - Front All-Season,Aluminum Wheels,Smart Device Integration,Bluetooth Connection,Automatic Highbeams,MP3 Capability,Driver Vanity Mirror,Keyless Start,Heated Front Seat(s),Back-Up Camera,Passenger Air Bag Sensor,Multi-Zone A/C,Rear Bench Seat,Floor Mats,Tire Pressure Monitor,Pass-Through Rear Seat,Rear Head Air Bag,Lane Keeping Assist,Driver Monitoring,Remote Engine Start,Immobilizer,Passenger Vanity Mirror,Front Side Air Bag,Front Head Air Bag,Front Collision Mitigation', 'dataLayerSectionName': 'features', 'order': 150, 'navigationAnchorName': 'vdp-options-widget', 'navigationTitle': 'Features &'}",LX,Dartmouth,,PA6609,Your Way Auto,Average,8.7,7.2,8.0,140.9,"{'specs': [{'key': 'Kilometres', 'value': '123,728 km'}, {'key': 'Status', 'value': 'Used'}, {'key': 'Trim', 'value': 'LX'}, {'key': 'Body Type', 'value': 'SUV'}, {'key': 'Engine', 'value': 'Intercooled Turbo Regular Unleaded I-4 1.5 L/91'}, {'key': 'Cylinder', 'value': '4'}, {'key': 'Transmission', 'value': 'CVT'}, {'key': 'Drivetrain', 'value': 'AWD'}, {'key': 'Stock Number', 'value': 'PA6609'}, {'key': 'Exterior Colour', 'value': 'Crystal Black Pearl'}, {'key': 'Passengers', 'value': '5'}, {'key': 'Doors', 'value': '4'}, {'key': 'Fuel Type', 'value': 'Gas'}, {'key': 'City Fuel Economy', 'value': '8.7L/100km'}, {'key': 'Hwy Fuel Economy', 'value': '7.2L/100km'}], 'showMadeIn': True, 'madeIn': 'canadaFlag', 'dataLayerSectionName': 'specs', 'order': 110, 'navigationAnchorName': 'vdp-specs-widget', 'navigationTitle': 'Specs'}",[],"This vehicle is <b>$2,156 BELOW MARKET (8%)</b>. It is compared to similar vehicles in the <b>Dartmouth</b> and adjacent area. It’s based on kilometres, year, make, model, trim, manufacturer certification, manufacturer packages, options, and much more.",,GreatPrice
https://www.autotrader.ca/a/honda/cr-v/kentville/nova%20scotia/5_62668560_20220830123611094/,2023 Honda CR-V,Honda,CR-V,2023,,11300,KMT,41999,CAD,https://schema.org/InStock,1.5L I4 16V GDI DOHC Turbo,Gas,Automatic,Sport ,"['Keyless Entry', 'All Wheel Drive', 'Dual Climate Controls', 'Adaptive Cruise Control']","{'showModule': True, 'showAllOptions': False, 'highlights': ['Keyless Entry', 'All Wheel Drive', 'Dual Climate Controls', 'Adaptive Cruise Control', 'Rear View Camera', 'Remote Start'], 'options': ['Leather Wrap Wheel'], 'dataLayerSectionName': 'features', 'order': 150, 'navigationAnchorName': 'vdp-options-widget', 'navigationTitle': 'Features &'}","{'showModule': True, 'showAllOptions': False, 'highlights': ['Keyless Entry', 'All Wheel Drive', 'Dual Climate Controls', 'Adaptive Cruise Control', 'Rear View Camera', 'Remote Start'], 'options': ['Leather Wrap Wheel'], 'dataLayerSectionName': 'features', 'order': 150, 'navigationAnchorName': 'vdp-options-widget', 'navigationTitle': 'Features &'}",Sport ,Kentville,,23166A,Kentville Chrysler,Low,9.1,7.6,8.4,140.9,"{'specs': [{'key': 'Kilometres', 'value': '11,300 km'}, {'key': 'Status', 'value': 'Used'}, {'key': 'Trim', 'value': 'Sport '}, {'key': 'Body Type', 'value': 'SUV'}, {'key': 'Engine', 'value': '1.5L I4 16V GDI DOHC Turbo'}, {'key': 'Cylinder', 'value': '4'}, {'key': 'Transmission', 'value': 'Automatic'}, {'key': 'Drivetrain', 'value': '4WD'}, {'key': 'Stock Number', 'value': '23166A'}, {'key': 'Doors', 'value': '4'}, {'key': 'Fuel Type', 'value': 'Gas'}, {'key': 'City Fuel Economy', 'value': '9.1L/100km'}, {'key': 'Hwy Fuel Economy', 'value': '7.6L/100km'}], 'showMadeIn': True, 'madeIn': 'canadaFlag', 'dataLayerSectionName': 'specs', 'order': 110, 'navigationAnchorName': 'vdp-specs-widget', 'navigationTitle': 'Specs'}","[{'description': "" Low Mileage!\n \n  Compare at $43259 - Kentville Chryslers Price is just $41999! \n \n    This  2023 Honda CR-V is for sale today. \n \nA legend returns! For 2023, Honda completely revised the ubiquitous CR-V, with a host of performance, design and technological upgrades to give it an even bigger edge against rivals in the ever-heated crossover SUV segment. With roomy seating, wide-open sightlines, and sporty details throughout, the all-new interior of the 2023 CR-V makes it easy to settle in and enjoy the ride. Upgraded infotainment systems with even more active and passive safety systems ensure a serene and uncompromised ride in this SUV.This low mileage  SUV has just 11,300 kms. It's  nice in colour  . It has an automatic transmission and is powered by a  1.5L I4 16V GDI DOHC Turbo engine. \n \n Our CR-V's trim level is Sport. This CR-V Sport steps things up with an express open/close sunroof, a power liftgate for rear cargo access, and a heated leather steering wheel, along with upgraded 18-inch aluminum wheels. With an all-wheel-drive system, this incredibly versatile and practical SUV features heated front seats, 60-40 folding split-bench rear seats, proximity keyless entry with push button start, adaptive cruise control, dual-zone climate control, remote engine start, and a refreshed 7-inch infotainment system with Apple CarPlay, Android Auto and Siri Eyes Free. Safety features include blind spot detection, front and rear collision mitigation, front pedestrian braking, lane keeping assist with lane departure warning, driver monitoring alert, and a rear camera. Additional features include front and rear cupholders, LED headlights with automatic high beams, USB-A/USB-C charging ports, and even more.\n \nTo apply right now for financing use this link : **********\n \n \n\nAt Kentville Chrysler, we have a professional and committed sales staff with many years of experience satisfying our customers' needs. \nWhile every reasonable effort is made to ensure the accuracy of this data, we are not responsible for any errors or omissions contained on these pages. Please verify any information with a representative. o~o ""}]","This vehicle is <b>$628 ABOVE MARKET (1%)</b>. It is compared to similar vehicles in the <b>Kentville</b> and adjacent area. It’s based on kilometres, year, make, model, trim, manufacturer certification, manufacturer packages, options, and much more.",,FairPrice
https://www.autotrader.ca/a/honda/cr-v/lower%20sackville/nova%20scotia/5_63866739_ct20031126125729691/,2018 Honda CR-V,Honda,CR-V,2018,Lunar Silver Metallic,46775,KMT,25995,CAD,https://schema.org/InStock,1.5L I4 Turbocharged DOHC 16V LEV3-ULEV70 190hp,Gas,CVT,EX,"['Intermittent Wipers', 'Heated Mirrors', 'Keyless Entry', 'Excellent Condition']","{'showModule': True, 'showAllOptions': True, 'highlights': ['Intermittent Wipers', 'Heated Mirrors', 'Keyless Entry', 'Premium Audio', 'Telescoping Steering', 'All Wheel Drive'], 'options': ['Roll Bar', 'Heated Seats', 'Power Locks', 'Air Conditioning', 'Bucket Seats', 'Power Steering', 'Traction Control', 'Dual Airbag', 'AM/FM Stereo', 'Fog Lights', 'Spoiler', 'Bluetooth', 'Remote Start', 'Tachometer', 'Power Seat', 'Anti-Lock Brakes (ABS)', 'Adaptive Cruise Control', 'Rear View Camera', 'Console', 'Tilt Steering', 'Rear Defroster', 'Rear Window Wiper', 'Cruise Control', 'Panoramic Sunroof', 'Power Mirrors', 'Security System', 'Power Windows', 'Stability Control', 'Trip Computer', 'Alloy Wheels'], 'extraOption': '5.64 Axle Ratio,18 Aluminum Alloy Wheels,Heated Front Bucket Seats,Fabric Seating Surfaces,Radio: 180-Watt AM/FM Audio System,4-Wheel Disc Brakes,Automatic temperature control,Brake assist,Delay-off headlights,Driver door bin,Driver vanity mirror,Four wheel independent suspension,Front anti-roll bar,Front reading lights,Fully automatic headlights,Garage door transmitter: HomeLink,Illuminated entry,Low tire pressure warning,Occupant sensing airbag,Outside temperature display,Overhead airbag,Panic alarm,Passenger door bin,Passenger vanity mirror,Radio data system,Rear anti-roll bar,Speed-sensing steering,Split folding rear seat,Steering wheel mounted audio controls,Turn signal indicator mirrors,Variably intermittent wipers,Front beverage holders,Speed-Sensitive Wipers,Bumpers: body-colour,Exterior Parking Camera Rear,Auto High-beam Headlights,Forward collision: Collision Mitigation Braking System (CMBS) + FCW mitigation,Lane departure: Lane Keeping Assist System (LKAS) active,Apple CarPlay/Android Auto', 'dataLayerSectionName': 'features', 'order': 150, 'navigationAnchorName': 'vdp-options-widget', 'navigationTitle': 'Features &'}","{'showModule': True, 'showAllOptions': True, 'highlights': ['Intermittent Wipers', 'Heated Mirrors', 'Keyless Entry', 'Premium Audio', 'Telescoping Steering', 'All Wheel Drive'], 'options': ['Roll Bar', 'Heated Seats', 'Power Locks', 'Air Conditioning', 'Bucket Seats', 'Power Steering', 'Traction Control', 'Dual Airbag', 'AM/FM Stereo', 'Fog Lights', 'Spoiler', 'Bluetooth', 'Remote Start', 'Tachometer', 'Power Seat', 'Anti-Lock Brakes (ABS)', 'Adaptive Cruise Control', 'Rear View Camera', 'Console', 'Tilt Steering', 'Rear Defroster', 'Rear Window Wiper', 'Cruise Control', 'Panoramic Sunroof', 'Power Mirrors', 'Security System', 'Power Windows', 'Stability Control', 'Trip Computer', 'Alloy Wheels'], 'extraOption': '5.64 Axle Ratio,18 Aluminum Alloy Wheels,Heated Front Bucket Seats,Fabric Seating Surfaces,Radio: 180-Watt AM/FM Audio System,4-Wheel Disc Brakes,Automatic temperature control,Brake assist,Delay-off headlights,Driver door bin,Driver vanity mirror,Four wheel independent suspension,Front anti-roll bar,Front reading lights,Fully automatic headlights,Garage door transmitter: HomeLink,Illuminated entry,Low tire pressure warning,Occupant sensing airbag,Outside temperature display,Overhead airbag,Panic alarm,Passenger door bin,Passenger vanity mirror,Radio data system,Rear anti-roll bar,Speed-sensing steering,Split folding rear seat,Steering wheel mounted audio controls,Turn signal indicator mirrors,Variably intermittent wipers,Front beverage holders,Speed-Sensitive Wipers,Bumpers: body-colour,Exterior Parking Camera Rear,Auto High-beam Headlights,Forward collision: Collision Mitigation Braking System (CMBS) + FCW mitigation,Lane departure: Lane Keeping Assist System (LKAS) active,Apple CarPlay/Android Auto', 'dataLayerSectionName': 'features', 'order': 150, 'navigationAnchorName': 'vdp-options-widget', 'navigationTitle': 'Features &'}",EX,Lower Sackville,,JH116661,Cars R Us,Low,8.7,7.2,8.0,140.9,"{'specs': [{'key': 'Kilometres', 'value': '46,775 km'}, {'key': 'Status', 'value': 'Used'}, {'key': 'Trim', 'value': 'EX'}, {'key': 'Body Type', 'value': 'SUV'}, {'key': 'Engine', 'value': '1.5L I4 Turbocharged DOHC 16V LEV3-ULEV70 190hp'}, {'key': 'Cylinder', 'value': '4'}, {'key': 'Transmission', 'value': 'CVT'}, {'key': 'Drivetrain', 'value': '4WD'}, {'key': 'Stock Number', 'value': 'JH116661'}, {'key': 'Exterior Colour', 'value': 'Lunar Silver Metallic'}, {'key': 'Interior Colour', 'value': 'Black'}, {'key': 'Doors', 'value': '4'}, {'key': 'Fuel Type', 'value': 'Gas'}, {'key': 'City Fuel Economy', 'value': '8.7L/100km'}, {'key': 'Hwy Fuel Economy', 'value': '7.2L/100km'}], 'showMadeIn': True, 'madeIn': 'canadaFlag', 'dataLayerSectionName': 'specs', 'order': 110, 'navigationAnchorName': 'vdp-specs-widget', 'navigationTitle': 'Specs'}","[{'description': 'The Honda CR-V EX all-wheel drive is a well-equipped vehicle that offers a range of features for both comfort and safety. It includes power windows, power door locks, tilt cruise, air conditioning, heated seats, a touchscreen entertainment center with Apple CarPlay and Android Auto, Bluetooth, a backup camera, lane change assist, cross-traffic prevention, Honda Sensing, adaptive cruise control, a powered sunroof, push-button start with proximity key, and remote start. With only 47,000 kilometers on the odometer, this vehicle is in excellent condition and ready for immediate use. Main location: **********. Clearance Center **********. Service Center **********. '}]","This vehicle is <b>$2,000 BELOW MARKET (7%)</b>. It is compared to similar vehicles in the <b>Lower Sackville</b> and adjacent area. It’s based on kilometres, year, make, model, trim, manufacturer certification, manufacturer packages, options, and much more.",,GreatPrice
